评论,评分
外形外观：朝露白这颜色真惊艳，整个机身轻巧，手感好运行速度：天玑1100处理器，试用了一天，运行很流畅，666拍照效果：4400万柔光双摄，拍照是我很满意的，照片很清晰、自然，效果也杠杠的屏幕音效：6.44英寸屏幕，显示好清晰，音质不错续航体验：一天电量还剩挺多的，够用,5
物流很快。隔天就到。第一次买vivo 买两。性价比高。 外观好看。大气。简约 很喜欢。运行很流畅 全屏的手机 不论是打游戏还是看电视 看小说都很好。 像素很高 出去玩拍照美美哒,5
很漂亮的一款S9，送媳妇的礼物?，一眼我就相中了这款颜色，反应挺快，运行内存12G+256G是我想要的大内存，不管是拍视频还是存照片儿都随便装。推荐亲们购买。,5
外形外观：真的炫酷，重量也刚刚好运行速度：1100堪比骁龙965 日常使用游戏完全没有问题拍照效果：很清晰，一直喜欢vivo一点就是人像拍的真的不错,5
上一部手机在使用打电话过程中，经常出现通话质量很差，对方听不到。心一横上京东买手机。今年购入手机的配置需求在12+256。经朋友介绍Vivo S9不错，对比了很多最终入手了。收到手机拆包装检查，没有损坏。外观颜值很高，一直不喜欢曲面屏，这款正合我意，12+3G内存，运行甚是流畅，装各种软件游戏测试，各种拍照测试，效果很好，NFC功能也很强大，继续玩**机中。京东的送货一如既往的快，赞一个！,5
这款手机颜值也太高了，爱了爱了，我之前用的是x9用了三四年了，也是差不多这个价格买的，一直都是v粉，机身很薄，拿起来很有份量，拍照性能也很好，不错不错  特别是现在有24期免息，不买才不买。,5
外形外观：挺好看的，是我喜欢的蓝粉色拍照效果：感觉还可运行速度：挺快的，不卡待机时间：一天是没问题的其他特色：充电大概一个小时左右能充满音质听了也挺清晰的，总体来说还是很满意的，我特意用了一天才来评价的接下来看图看视频，图是旧手机拍的不是很清，新手机颜色很喜欢，而且还配送到本人手中，整体来说，物流态度很好，还配送原版的手机壳，卡针，已经耳机，熄屏显示在设置里面可以自己设置，之前就用的vivo手机，所以用着很顺手，到手的时候包装非常完好满分好评,5
手机收到了，外观非常好看，老婆很喜欢。配置也高，拍照效果也比原先手机好很多。看视频非常清晰，对这次的选择很满意！！！,5
机子颜色非常漂亮，较薄，金属边框，颜值特别高，系统比较流畅，占用空间不大，屏幕亮丽，AMOLED屏，真的很不错。建议vivo以后能用鸿蒙系统，说真的，自己的鸿蒙系统真的流畅。,5
手机收到了，好漂亮，颜色好看！运行速度很快，拿起来刚刚好！外包装也好好看，真的满意！,5
手机收到了质量不错，外形外观：外观太漂亮细腻湿滑颜色很诱人屏幕音效：屏幕清晰透亮，喜欢呀拍照效果：前置拍照直接没话说，太漂亮太清晰了，把我拍的直接没话说，直接赞????????????????????运行速度：运行内存直接没话说好快,5
一收到被它的颜色惊艳到，非常好看，超级适合女生用，续航能力还可以，基本一天一充，运行速度很流畅，性价比高，第二次用vivo手机，很满意哦。,5
vivoS9这款手机性能真心不错，外观新颖，手机非常轻薄，通话音质也好。收到后迫不及待地拍了照片，像素真心不错，色彩饱满度高。内存很大，再也不用担心资料不够存了。真是一款高性价比的手机。,5
手机已经收到了，非常不错的手机，首先物流很快，十分给力，然后满怀期待的心情打开了包装袋，拿出来一看，发现手机包装都非常严实，很用心呢，然后开启了手机，运行也十分流畅，速度也比较块，果然这个vivi的品牌就是没有让人失望，电池的续航能力也十分有保障，不再担心手机用不了多久就会没得电，导致焦头烂额了，十分符合预期，最后其价格也还可以，物有所值,5
手机用下来各方面都不错，运行非常流畅，屏幕很大。机身轻薄，颜值也很搞，触感轻盈，反应灵敏，会一直支持vivo哒！,5
这手机真喜欢，今年3月份能出的，手感很好，摄像头也很喜欢，整体来说很不错。很方便，扫一扫旧的手机就能把那个手机上的资料全部传过来了。,5
手机到手了，突然整个人心情都棒棒的，说实话，第一次用vivo品牌，手感很好，反映也不错，毕竟我买的是顶配，后续使用良好会追评，前天晚上下单今天就在手，发货速度杠杠滴,5
用一段时间再来评论 现在还不知道电池耐不耐用 反正还是非常满意的,5
这款手机真的非常好看，颜值高，很喜欢中间分中的全面屏，其他挖孔屏的就不太好看了，而且这款屏幕够大，分辨率够清晰，相机功能够强大。前两天领劵还减了150，非常值得购买。,5
手机的颜值很高，外壳超级漂亮，手机的续航能力也非常的好，充满电差不多可以用16个小时，运行速度也很快，有很多小细节非常不错哦！,5
很棒,5
手机已经用了好几天，比我之前的华为好用，颜值很高，这款颜色太喜欢了很好看，拍照功能强大，充电很快，这是我用的第二款vivo手机，很喜欢,5
用了一段时间来评价的，使用体验非常好，系统流畅，而且比其他安卓手机系统流畅很多，反应很快，音响效果非常不错，用来做备用机和打车、购买视频、音频平台会员都是非常不错的选择，充电器是50w的，充电速度非常快，也不会出现电池变热的情况，基本上每2、3秒就提高电量百分比，颜色、样式也都非常不错，严重推荐！,5
手机超好看的，一直信赖vivo手机，这是我买的第6部vivo手机了，vivo的忠实粉丝，我也用过别的牌子的手机，感觉没有那么好用，卡还容易坏，用的气死人。以后换手机还是只换vivo这个牌子的只有这款手机用得最久，很满意！,5
京东快递给力，今天买，明天到。 手机给老婆买的 ，老婆非常喜欢 ，手机反应快 ， 听歌 ，拍照，摄像非常好 ，手机待机还可以 ，非常满意 。,5
产品质量确实非常满意！像个人电脑一样，具有独立的操作系统，独立的运行空间，可以由用户自行安装软件、游戏、导航等第三方服务商提供的程序，运行快捷，下载软件极快啥也別说了，直接五星好评！,5
颜值太高了，拍照很棒，一到手就各种拍摄，真的是美极了，很喜欢，很划算是正品外形外观：颜值超高拍照效果：自拍很赞，拍照功能很齐全,5
S9外观非常秀气，体型也比较轻盈，送的快充很给力，充电速度杠杠的，这次买了高配，之前的nex已经用了三年了，除了存储快满了，别有其他大问题，支持我们的国产手机，性价比很不错！！！,5
拍照前置4400w后置6400w摄像头，广角双摄极速对焦是这款手机的亮点，此外，外观漂亮、机身轻巧、内存大、电池续航超强使得手机超值。,5
手机外观漂亮，颜色特别适合女生喔！拍照清晰，适合宝妈给宝宝留念，使用流畅，心情美丽，京东618价格也美丽，值得推荐,5
手机非常漂亮，很适合女生，拿在手里很有手感，拍照超级清晰，大爱。,5
用了半个月了，没出现什么问题，颜值我太爱了，闪充我更爱，平时就看看视频，偶尔玩游戏，完全够用，冲冲冲！,5
物流很快，拍照效果很好，反应速度也是很快的，指纹解锁灵敏，自带的Jovi功能很是喜欢。自带的软件略多了点，128G内存占了32G,5
手机收到，用过了才来评价的一直用vivo这个牌子的手机，身边的同事朋友都是用的这个牌子的，性价比高，超喜欢这个莫奈漫彩渐变色的，非常漂亮，内存大反应快，拍照很清晰，超广角的镜头，s7刚上市就看上了，外观好看手感也很好，手机轻薄舒适，京东自营vivo大品牌值得信赖，喜欢的赶紧入手吧。京东物流很快，快递小哥很给力晚上七八点还在送货上门，京东服务没得说。超赞?????,5
外形外观：大方上档次，直边设计，手拿着很好屏幕音效：屏幕细腻，没有马赛克的画面，喇叭的音质很好，立体声环绕拍照效果：前置摄像头拍照非常666，自带美颜，后置摄像头稳定，运行速度：一点也不卡待机时间：很省电，充电也快其他特色：外形尺寸正好,5
手机超级漂亮，给我婆婆买的，她非常喜欢。后续会继续观察使用情况。手机功能强大，但是老人家也用不了那么多功能，主要是希望能用得久一点，不要一下子就卡就行了,5
这个S9，拍照超级好，尤其是自拍，再也不需要美颜相机了。这个颜色超级喜欢，颜值也高。,5
果真好用，外观大气颜色好看，手感也不错！像素真的太赞了，充电速度也快，喜欢！,5
照出来的人是扁的，还拍照手机,5
新手机很轻薄，还送了贴膜和手机壳，里面有耳机线和充电线，拍照比之前好多了，母亲好喜欢?外形外观：颜色好亮眼屏幕音效：很好拍照效果：很棒运行速度：好快，目前可以待机时间：长,5
外形外观：眼前一亮，真的很好看屏幕音效：还可以，声音效果还可以拍照效果：挺不错的速度运行，挺好的待机时间，挺好的手机效果，用一段时间才知道好不好，手颜色很好看,5
"非常喜欢，第一眼就看上了这款蓝色，机身很薄，摄像头看起来很有质感，拍照片很清晰，美颜功能太强大了，内存也可以，充电很快,正常玩看看电视剧 段视频什么的晚上还能剩很多电。",5
"不错，收到手机后非常满意。运行速度快，联发科的天玑1100处理器堪比高通骁龙865处理器，拍照效果清晰，很早以前用的vivo X7,x7用到现在，该退役了，现在一如既往的支持Vivo。s9拍照美颜功能强大，专为女人定制，N  I  C  E,666",5
女生玩自拍真的是不错的选择，喜欢手机背面的渐变色，刷抖音特别快，天玑1100处理器无卡顿，ViVO?手机大赞一个?,5
外形外观：很好看，和视频图片一样屏幕音效：很好拍照效果：照亮你的美运行速度：12＋3就是快待机时间：好其他特色：总而言之就是好，比较满意。发货速度很快，不愧是京东自营,5
发货神速，早上下单，晚上就收到了，外观时尚，拍照清晰，运行十分顺畅，一直在使用vivo，性价比超高，抓住618活动机会就下手,5
手机外观精致，大小合适，握感很好，使用起来运行流畅，也不怎么发热，充电速度快，每天晚上充电，白天随便用都还没有遇到无电的情况。拍照很赞，非常满意，值得购买！,5
手机收到，拿在手里沉甸甸的很有质感，一直用vivo手机，就认准这个牌子拍照效果：拍照一级棒运行速度：运行很快，没有卡顿,5
外形外观：机体颜色很好看，送的透明手机壳正好放偶像照片。???&bull;?&bull;????屏幕音效：已使用两天，屏幕触感较好，音质质也超棒???&bull;?&bull;????拍照效果：拍照超清晰。超大广角拍摄范围更广。照片是隔着玻璃随手拍的。像素是真的可???&bull;?&bull;????运行速度：经过两天的使用，顺手且流畅待机时间：电池容量大，待机时间长。其他特色：希望vivo越来越好?,5
这款手机外观漂亮，显示效果很好，运行速度快，特别是拍照效果真好！ 值得推荐。京东快递一如既往地好，赞！,5
物流非常快，第二天就到了。另外打开之后很惊艳，给老婆换一个手机，所以选择的这个颜色，她非常喜欢，运行很快，推荐。,5
一款颜值非常高的手机，惊艳到了我。内存大，运行速度快，流畅，拍照效果好，还赠送了耳机，值得拥有。618抢购的，优惠多多。物流速度也很快。好评！！,5
第一次买了S7，用的感觉很好，就又买了台S9，比S7厚一点，但是运行速度快，手感很好，有24期免息分期，性价比杠杠的，咱只买对的，感觉完美，美美哒！,5
给老婆买的手机，老婆很喜欢，特意用了几天之后再来评价，首先外观很漂亮，很大气，其次12+258的内存运行起来一点也不卡？速度快到飞起，强烈推荐大家购买,5
给老婆买的手机，买手机看了好多款，最终买了这个s9，这款手机拍照，和自拍像素都很好，老婆爱拍照，用了好几天了，很流畅，充电快，续航也还行，就是不知道这个天玑1100芯片以后咋样了，老婆不打游戏所以给她买了这款，整体看来还不错,5
外形设计时尚大气，外观很好看，屏幕音效很好，拍照效果那是没话说，十分清晰，运行速度也很好，待机时间蛮长的，充电也很快，给父亲买的，他很满意！,5
这款手机心仪很久，刚好自己生日就买了送给自己的生日礼物了，用三天再评论的，手机很好用超喜欢，耳机音质非常好，好评,5
刚收到手机就迫不及待的打开了，看了一下确实不错！很喜欢！用的很流畅！特别是拍照功能真的很强大！总之是非常的满意！,5
很流畅，要是刷新率再高点就更丝滑了。电池续航很好，基本一天半一冲。整机重量也很轻。整体感觉很棒,5
很好用，特意用了两天来评价的，京东物流就是快，给力！收到真的很惊喜，手机盒子很漂亮，手机也惊艳到我了，真的很漂亮，手感也很好，是我想要的样子，运行速度非常快，这么大的内存够我用的了，拍照也非常的好，很清晰，夜景也清晰，喜欢拍照的可以选这款，真心推荐。太喜欢了,5
手机颜值很高 ，很好看  ，  运行很流畅  ， 玩游戏也不卡  ，拍照效果也很好  ，  很清晰 ，  充电很快  。,5
外形外观：时尚潮流，特别喜欢拍照效果：色彩逼真，清晰完美屏幕音效：音质效果非常不错?运行速度：一点不卡顿，用起来很顺手。待机时间：充电也特别快，待机时间足够玩一天了。感觉很棒哦！,5
家里长辈都用的vivo，这次给爸爸换了一个新的。这款手机最大的优点就是超薄，超轻，拿到手非常轻便。各方面都很好，子夜蓝也非常适合长辈，其他功能正在慢慢探索中。,5
外形外观：工作用机，颜值没得说！超薄的，比其他安卓机薄了很多，和?12媲美！屏幕音效：色彩斑斓，刷新率真的是好！拍照效果：夜景很美，前置摄像头闪光是亮点！运行速度：8+3很香哦！反正也不打游戏！待机时间：稍稍有点差强人意！其他特色：出厂膜真没看出来，我还问客服呢，为什么不贴？原来真是有，但是很难看出来，细节上做到了极致！国产机质量的良心之作！,5
vivo这款千元机性价比还不错的，芯片是联发科的芯片。手机颜值也在线，颜色好看，手感也挺好的！也支持5G信号。双卡双待，电池容量也大，前置摄像头是4400万的像素一直很信赖京东自营的东西，有保障，快递送货速度也很快的！还会继续支持的！,5
太美了，这外形，永不过时，操作起来非常棒。,5
颜色好看，运行速度很快，拍照效果很好，充电速度挺快，,5
怎么说呢，东西还没怎么用，目前还不敢断定。。。从目前来看，手机挺不错新机嘛。。。差评里的那些，还没遇到，总体满意。屏幕感觉也很好，指纹灵敏度可以，画面清晰，反应速度很快，挺满意的。。。。。。。后续看看情况如何，到时候再来追评吧。。。。。,5
第二次买vivo了，不错外形外观：颜色是随阳光变换的屏幕音效：屏幕清晰音效流畅拍照效果：前后摄像头都有广角拍摄，拍照清晰运行速度：运行流畅，反应也很快待机时间：充一次电可以1天，总玩手机的话，一天充2次其他特色：充电速度很快，真的闪充,5
还不错?充电很快拍照效果：很清晰运行速度：很流畅外形外观：后壳颜色漂亮,5
颜值非常好看?背部磨砂质感，高级的感觉！！！直板设计，经典回归，握在手里非常舒服?自拍模式还有好多种柔光模式，真是照亮你的美！！！值得入手?,5
外观漂亮，手感细腻，画质清晰，送女神正合适，一直都用VIVO的手机，真实用!之前一直担心手机过重，后面拿到手机才发现，自己想多了，非常轻薄！,5
给妈妈买的，新款果然外观大方，颜色美观，灯光下不同的角度会变成不同的颜色，使用很流畅，一直喜欢Vivo,5
手机外观很漂亮，拿在手里很有份量，颜色漂亮手感好，屏幕大小合适，拍照很清晰，效果好。解锁和运行速度都特别快，待机时间也比较长。,5
真的很惊艳啊，我买的白色的，闪闪发光，特别的亮，颜色好爱啊，喜欢玩游戏下载了一个明日之后，运行起来完全没有问题，应该能用好久,5
赶上活动果断下手，价格美丽，给老婆买的，已经用了一段时间了，vivo的操作系统用起来还是很顺手的，手机轻薄，外观艳丽，拍照性能好，天机1100处理器，对于不玩游戏的来说游刃有余，老婆很满意。,5
爱了爱了，这个手机颜色真好看，特意用了一天才来评价，非常顺手，拍的照片特别好看，晚上拍的照片也特别的清楚,5
手机买来是送给媳妇的，第一次选择vivo这个品牌，是朋友推荐的，京东物流给力，第二天上午就到了。手机背盖很炫很漂亮，外观设计非常棒，系统运行超顺畅，屏幕显示效果好，看着舒服，外包装很有特色，好评好评！,5
手感超级好 开始用的第一款智能手机就是vivo 超薄设计太赞了 朋友推荐入的这款因为处理器好说是运行很赞不卡 至于照相功能试了一下 很强大 很暗的环境拍照也清晰 其他的要等正式用的时候才能看效果 总之这个价格很值 用了分期 等于每个月多交一份话费 推荐,5
美轮美奂，第一次购买vivo手机，真的感觉颜色，外型，包含摄像头都是我喜欢的，以后就一直支持vivo手机了?，价格适中，造型真美，后壳菱形设计美轮美奂，拿到手里也是感觉像个宝贝一样，真的很满意，感谢京东，以后就支持vivo手机了.,5
直播间购买的，还多送了一个充电器，三千元以内的国货，性价比非常高了，外观设计简约大气，使用过程流畅不卡顿，充电快速，使用感受非常好，希望我们的国货可以越做越好，加油！,5
手机非常漂亮，后摄像头还带防抖功能，前摄像头更不用说了，拍的真清楚眼眨毛都拍出来了，两个闪光灯也很给力，续航还可以一天没问题，vivo质量不错，好几个vivo手机了，希望一直好下去！,5
外形外观：外观很惊艳，很超符合我的审美拍照效果：拍照美颜功能真是太棒了运行速度：运行超快，吃鸡王者无压力,5
外形外观：简约大气有质感；屏幕音效：声音立体，音质好；拍照效果：前置3200万超清夜景，并且自带美颜功能；运行速度：开关解锁非常快，运行也不卡顿；待机时间：电池容量达到4500mh，所以正常一天使用下来都可以不用充电呢；其他特色：充电速度非常的快；这款手机真的超级适合女生来使用（当然爱美的男士也可以选择，颜色可以选择别的也不错哦），年轻时尚的一个单品，平时也可以用来拍摄短片及视频，要物尽其用。而且是5G手机，现在的流行趋势，以及人性化的操作系统。优点简直太多了，建议大家换手机的首选哦。支持国货品牌！,5
S9高配手机质感很好，画面显示很细腻，操作系统也很好，拍照功能很强大。老婆拆开包装后爱不释手，大赞手机颜值高。原本我打算买华为手机，但老婆指定要买vivo手机，果然老婆的选择是正确的，让我对vivo手机的做工有了全新的认识。,5
这个外观是真的好看，不同角度还会有轻微的不一样，流畅度也很好，屏幕的原彩显示也不错，看视频干啥的目前还没出现过卡顿现象，续航的话也是很不错的,5
手机是给媳妇买的，上午买下午就到了非常快，手机很不错，我只是实话实说，外观设计可能我更喜欢一些，运行速度和内存容量这个就不用说了，新款手机嘛，肯定没的说，客服的服务态度也非常好，我特意问了一下女孩子适合哪一个颜色，客服不厌其烦的跟我一个一个发给我看，真的很棒，很赞,5
朝露白真好看！！！颜色干净，给妈妈用，这个足够了，拍照很给力。可以指纹也可以面部识别，很方便。,5
体验感很好，像素超乎想象，被种草了 这个价格真的超值，没化妆自拍效果也很好还有妆容磨皮瘦脸之类的，感觉省了下次美颜相机了,5
用了一段时间过来评价，非常好用的一款机子，速度快，照相美，电池用的时间也长，618时候买的还很划算，上午下单，下午就送到了，物流超级给力?,5
外形外观：外观完美颜色漂亮，尺寸合适，一点也不厚屏幕音效：非常好，拍照效果：像素很高运行速度：非常快，游戏无卡顿待机时间：半天就下去百分之三十其他特色：手感很好，提前订购还送了小度音响,5
屏幕的色彩很好，90hz刷新率很丝滑，系统运行流畅，功能很强大，很稳定，照相很清晰，尤其是前置摄像头非常出众，轻薄又漂亮，金属边框，续航真的是不行，玩得多是撑不了一天的。很适合女孩子使用，不建议商务男士使用。,5
针对这款手机送的保值换新活动，我必须追评一下，回收其实不是京东回收的，是爱回收公司的，申请保值换新后，新S10pro手机买了，爱回收对我的S9手机却以各种理由不给我回收，手机完好无损却回收不了，爱回收那边一会说京东系统有问题，一会又说订单异常，只能给我按5元钱进行回收，选的到店回收，因为选的新乡，正好碰上新乡暴雨受灾，客服说可以到洛阳回收，我回到洛阳，洛阳的爱回收店却说不行，等了几天打了好几个客服电话，最后还是只能到新乡的爱回收店。到店又没人，让我等几个小时，还说不一定能给我按保值换新价回收。非常气愤，这不是玩弄消费者吗？,5
用了一个月来评论下，用起来很不错哦，之前一直使用Vivo手机，用起来还不错，这款外观很炫，屏幕全屏比较大，拍照效果很好，运行速度也很快,5
手机的外观很好看，简单，拍照的效果很好，很清晰，运行的速度也很快，内存也是够大的，京东快递的物流很快，用过一段时间再来评价。,5
给孩子买的，很喜欢。颜色也是他自己挑的。拍照效果：好外形外观：漂亮运行速度：快屏幕音效：纯,5
外形外观：手机很漂亮，女朋友很喜欢，，指纹解锁很方便，拍照异常清晰，尤其是美颜效果，嘎嘎的，充电也很快，电池大，续航能力好，画质清晰,5
说实话！机器很漂亮！比想象中颜值要高！现在用着还比较顺手！就是不知道用一段时间后，电池会不会很不经用！要是电池经用！不卡顿！这就很好！,5
618活动买的，线下门店看完很久了，就等活动降价，终于得手了?颜值超高，颜色三个都很好看，网速很快，摄像是6400的，清晰,5
Vivo手机大品牌值得信赖和购买！！！618时候买的发货也很快！！！外观也很好看特地用了几天才来评论的！没有让我失望！！！很好！！！喜欢的赶快行动吧！！！,5
外形外观：非常高大上屏幕音效：很清晰拍照效果：像素非常好运行速度：很完美待机时间：待机用2天其他特色：总体来说 这个价钱值了,5
质量特别好，性价比非常高，外观非常好看，送了手机壳，还有耳机拍照效果真的没法说，真的特别好，拍照非常清晰，特别适合女生用，运行速度非常快，功能齐全，反应很快，非常满意，下次还来,5
朋友推荐的给老人买的手机，发货很快，第二天就拿到了。打开包装后，印象时光色很漂亮，老妈很喜欢。新系统用起来很顺滑，摄像方面也很出众。总之，外观出色，手感轻薄，自拍和后置拍摄及其它性能都非常出色，很满意,5
外形外观：外观设计非常漂亮，背面是贝壳一样的，对着光会有不同的反光色屏幕音效：屏幕很精细，音效可以拍照效果：拍照效果很棒运行速度：速度很快，流畅待机时间：时间一天其他特色：稍微厚了点，如果能再薄点轻点就好了,5
