评论,评分
是送给妈妈的礼物，妈妈很喜欢，机身轻薄，开机速度快，指纹灵敏，屏幕分辨率清晰，色彩鲜艳亮丽，有不刺眼，声音也大，拍照效果也OK，反正妈妈喜欢就是最好的礼物。运行速度：快，不玩游戏，普通程序没有问题。拍照效果：挺好的。屏幕音效：非常好。外形外观：外观简单，机身轻薄，刷视频完全可以单手操作。,5
外形外观：高端大气上档次，低调奢华有内涵。屏幕音效：整体来说还不错。拍照效果：拍照和其他手机就是不一样，摄像方便更出众，前置超广角自拍双摄，加上柔和灯光加持，怎么拍都好看，真是完美，喜欢的不的了。待机时间：用了4个小时才掉17％电。其他特色：白色带细闪的外包装就很吸引人，入手的印象时光色，实物太漂亮了，会根据光折射出不同色彩，颜值刚刚的运行速度：满意，运行速度飞快，超级带感，打游戏也很棒，特别流畅。,5
家里买了两个s9了，**最近买手机我又推荐了，真的不错,5
比较了好几天，还是选这个，相机真是好用,5
颜值很高，质量很好，很好用，很满意。发货很快，已经收到货了，商品和描述的差不多，质量没问题，关键价格也合适，在这里买还是很放心的，好评！,5
拍照还好，就是感觉天机好像不是很好用，比较适合女孩子吧，外观颜值也不错，感觉屏幕容易刮花，刚开学就花了，可以自己换钢化膜吧！,5
好,5
咋回事，***聊关闭声音，还是有提示,5
给家人买的手机，目前没有说有啥问题,5
外形外观：喜欢哈哈哈屏幕音效：也很好运行速度：快，不卡呀，好用,5
电池不耐用,5
发货快，快递给力，一天就收到手机了，手机非常好用???,5
外形外观：外观新颖，时尚潮流屏幕音效：屏幕清晰，显示效果非常棒拍照效果：美的不行运行速度：杠杠的，忒快了待机时间：本人不怎么玩游戏，够用了其他特色：嘎嘎嘎得,5
好很好非常好，京东物流飞快，京东小哥服务态度很好，昨天下单今天到，拍照效果很好，运行飞快，质量没问题，一直都用ⅤⅰⅤ0手机，先用一段时间再来追评????????????????????,5
vivo S9手机确实好看，朝暮白，这个电池后盖也非常的绚丽多彩，这个厚度也是很薄的超级喜欢，握在手里很适合手型，舒服， 手机的自拍也是绝了，可以和别的手机的后置pk了，手机搭载1100芯片，基本都够用了，推荐购买~~,5
外形外观：好看屏幕音效：单外设音筒，遗憾拍照效果：好运行速度：很快。 电源键是磨砂摁键，挺喜欢这点,5
很漂亮的一款手机，手感很好，很轻薄，颜色超正。充电很快就满了，运行速度也很快，打游戏很流畅。这是我第一次用vivo手机，觉得非常满意。,5
s9刚刚上市就入手了，刚玩了一下，前置拍照非常清晰，自拍再也不用P图了哈哈哈，不愧是自拍旗舰，外观大气轻巧，触感灵敏，功能也很齐全，总而言之，满意！,5
拍照效果：很好，加特效更好运行速度：可以外形外观：很漂亮，闪闪的待机时间：充电快，用电也快屏幕音效：可以，声音比吵架还大声其他特色：发热算不算特色？,5
第一次买这么贵的东西很不错，非常好用，天玑的处理器速度非常快，打游戏也不卡，非常流畅，耳机都有的，充电速度真的是太棒了！买的子夜蓝颜色真的好看，喜欢,5
手机比预期的要好，各方面很满意，vivo加油！,5
预售的效果还是蛮不错的，发货速度很快，快递小哥也很给力，当天就收到货了，拿到手看一下，觉得还不错的，以前都是用华为的机，这是第一部vivo手机，还是不错的，期待后续好用吧?后续用了再来追评。,5
感觉感反应快，尤其拆完手机套拍照片晒单瞬间到了地上，比5G快多了。昨天收到货开心，今天心塞了回去，不过小事情。我大意的动作人为的。言归正传，夜视拍照很惊讶，前面两灯光很个性。外观手感方面看着特别舒服。打游戏无高温发烫现象，非常满意的,5
拍视频特别清晰，电池耐用。而且自带APP（i管家）可以设置移动数据连网关闭，需要时打开，不会跑流量，有收到短信，屏边缘有氛围光效，自己喜欢设置，太好看了，很喜欢，够酷炫。,5
外形外观：外形非常惊艳，一眼就爱上，时尚休闲设计，看起特别舒服。屏幕音效：屏幕分辨率很高，音质没得说，这款手机的亮点之一。拍照效果：拍照效果是这款手机最大的特色，爱不释手，简直让人惊喜。运行速度：没有卡顿现象。,5
冲着颜值买的，外观太漂亮了。这是用过的第三个VIVO手机，很喜欢拍照功能。****也很方便，一会功夫就用上新手机了。京东次日达很棒。,5
外形外观：外观也漂亮运行速度：很快。拍照效果：拍照效果真的超级超级漂亮啊其他特色：充电时间很快，一直在荣耀个和s7犹豫，不知道选择哪个，最后还是拍了这个。手感真的太好了。,5
手机颜值很高，手感也很不错，很薄，目前感觉稍微有点长，但应该用一段时间就习惯了，很喜欢，第一次用vivo手机，朋友推荐的，刚拍了一张照片，确实不错，听歌音效也不错,5
给媳妇买的手机，媳妇很喜欢，拍照很亮，适合给孩子拍照，拍出照片都很好看。,5
很好用的一款手机,5
外形外观：光学的后壳看着特别漂亮。拍照效果：拍照效果很不错，尤其是前摄，特别适合自拍，效果很好。运行速度：运行流畅待机时间：正常使用一天一冲。超薄的机身，金属中框，适合女士，重量和手感特别好。,5
"之前用过vivo,比较轻薄，手感好，当时就觉得很好用，最近要换手机果断又选了S9.,在颜色上纠结了很久，最终下单白色，拿到手绝对超乎想象，一个字:好！两个字:漂亮！三个字:很大气，是那种有层次感白中炫彩的感觉，素静又不失活泼。大小合适，有质感，上档次，反应快，感觉系统还不错！来3张照片看看，正面侧面加背面，希望给有意向的宝宝们一些参考！",5
这款手机，照相非常清晰，一直都很喜欢，手机使用起来很流畅，玩游戏也可以，拍照功能很能打，出门拍照，拍视频毫无压力，电池也非常耐用，对于手机不离手的我来说，非常够用，以后会持续关注新品,5
爱了，爱了，vivos9全方面都让我很满意，外观设计高端大气好看，而且机身正面则是一块6.44英寸的AMOLED屏幕，分辨率达到2400&times;1080，并且支持90Hz的屏幕刷新率以及180Hz的触控采样率。并且这块屏幕还支持了HDR10+，并且通过了德国莱茵T&Uuml;V低蓝光认证，不仅显示效果更加出色，同时还可以在长时间使用的时候降低用眼疲劳，拍照功能更没得说！大赞?他还加入了运动抓拍功能，这对于不少朋友来说可能是解决了大问题的。在拍摄小动物或者家里孩子的时候，可能一直处在运动的情况，那么运动抓拍功能会通过EFB追焦和万物追焦技术保证不丢失主体，即使是拍摄运动物体也能够非常清晰，在性能方面也表现不俗，它搭载了天玑1100旗舰芯片，这也是基于6**制程工艺打造的旗舰芯片，采用业内领先的A78架构，主频可以达到2.6GHz！爱了！,5
用了一个星期了，来说说感受吧！外观漂亮，很是炫彩，赏心悦目，反应也很快，很流畅，这个屏幕尺寸女生单手操作也OK，拍照果然很强大，不愧是主打拍照手机，电池也比较耐用，正常玩一天足够。活动入手的，分期免息付款，还送一个双肩背包，很满意,5
vivo老用户了，用了几天来评价的，快递照旧给力，隔天达，包装完好无缺，手机外观漂亮，女孩用推荐印象拾光，操作流畅，内存够大，音效清晰，特别是自拍照特别清晰，喜欢拍照的推荐入手，真实体验,5
外观大气，系统流畅，电池非常给力，基本上两天充一次，非常满意的一次购物，值得信赖的品牌。拍照效果：清晰，艳丽运行速度：反应灵敏待机时间：超长,5
第一次买vivo手机，手机颜值很高，朝露白大爱，不同的角度有不一样的流光，很轻薄，相比挖孔屏，我更喜欢这种刘海屏，新机系统很流畅，手机才拿到手还没怎么玩，期待发现更多优点,5
看了很多手机，最终选定这款，拍照很好看，新手都可以拍的很好看，照亮我的美。我小孩帮我照，都把我照的好看，适合我这种女生用。大家想把自己拍的美美的，就赶快下单买。,5
这个子夜蓝太好看了！没光的时候显黑色，商务感觉，有光的时候看起来蓝色，高端大气上档次！特别是摄像头的矩形布局和机身边框的矩形设计，非常的喜欢～12G加256G，简直是站在日常使用的顶端了，什么都不用担心！,5
颜值非常高的一款手机 颜色随着角度的不一样会变化 而且机身的感觉也非常的简约 尺寸设计的也很好 屏幕占比率很高的很好 挺满意的,5
s9的颜值惊艳了我，非常喜欢，拿在手里很有质感，拍照很清晰生动，刚收到货还没有充满电，充足后看看待机多久。目前很满意！?,5
老头很喜欢,5
不错，用的还可以。物流快,5
我老婆说可以挺好的，手机反应快不卡,5
不错内存大,5
挺好的，而且客服真的很耐心很好,5
给女儿买的,5
拍照效果：拍照很清晰，不愧是拍照手机待机时间：电池续航能力也是不错哦，之前看到有人评论说电池不耐用，不过我觉得没有那么夸张，如果不是长时间玩游戏，这续航用一天没问题的屏幕音效：铃声好大声哦，老人家用也是可以的哦,5
此用户未填写评价内容,4
媳妇感叹美颜的强大，拍照也厉害，她满意就好！,5
这是给家人买的第三只Vivo的手机了。特意用了两个月才来说说它。外形大方，尺寸合适。使用流畅，拍照效果佳，虽然比不上60x，但是平时随便拍拍还是满足的。耳机孔和充电口是一个口。2000多元的价格很实惠，S9性价比高。,5
配送速度快，该有的配件都有，手机拿在手里手感很好，子夜蓝颜色也不错，简单大气。功能没任何问题，完全超出了期望值。,5
像素不错拍出来很好看，外观，音质 像素 运行 都不错的。手机性能没得说，好评,5
手机包装很精美，打开一看，很喜欢，外观设计很好看，颜色也很喜欢，颜值高，内存也很大，价格也不贵，快递小哥送货上门非常快就收到了，很满意？,5
颜值高，很好看，很好用，进游戏刷新特别快，妹妹说好用。,5
颜值高，拍照模式很多，操作简单，充电很快，耗电还行，一天一充。附带有透明手机壳，立即装上了。,5
外形外观：设计感十足，低调中不失优雅屏幕音效：音效很好，不刺耳，音乐动听，拍照效果：没的说，个人拍照足够用，运行速度：目前很好，够用了，从苹果换过来的，目前能做的就是不用苹果，,5
这是家里入手的第三个vivo的手机了。包装精美，开机速度很快，运行流畅，无论是玩儿游戏还是看视频，那都没得说。京东分期没有利息，特别的划算。京东物流到货非常快，虽然赶上618那会儿，依然没有延迟。购物体验很好，手机物有所值，值得购买！,5
手机质量很好，很有质感，款式很好，快递一天就到了，很好用，待机时间很长，充电速度也很快，像素很好，照出来的照片很漂亮清晰，很喜欢。,5
"外形外观：这是送给媳妇的，超级喜欢。今年的第二部vivo手机,一直关注s6,s7一出果断出手,我觉得vivo性能稳定,续航超强。s7机身轻巧,手感好,一触就上瘾。屏幕色彩鲜艳,声音出色。拍照用了:前置4400万后置6400万摄像头, AF广角双摄,疾速对焦捕捉每一个瞬间,拍出来的照片更清,更广,更美。运行内存大,一点都不卡。大容量电池,续航更强,还有NFC等智慧功能,一部,值得拥有的手机。6秒",5
手机外观设计是我喜欢的风格，手机也很轻薄，系统挺流畅的，待观后效吧,5
手感特别好 外观漂亮 运行速度也快 拍照也很清晰 我平时也不怎么玩手机 电量也很耐用 总之一句话 好,5
手机收到了，用了一段时间再来评价感觉非常好用，速度反应快，外套时尚大方，高端大气，手感非常好，拿到手里面有分量体面，值得购买！,5
外壳很好看，闪闪的，个人是很喜欢这种金属直边圆角的侧边，运行速度快，屏点很灵敏，而且拍摄功能很多，拍照效果超级好，非常适合喜欢自拍的我！,5
手机的颜值很高  ， 颜色很好看，   重量  ， 手机大小也合适  ，   拍照效果可以  ，运行速度也还好  玩游戏什么的都可以。,5
外形外观：颜值很高，是我喜欢的类型屏幕音效：试了一下，音效也没得说拍照效果：非常棒，有图为证运行速度：目前还可以，没啥卡顿的待机时间：我感觉待机应该不是特别好，感觉耗电量挺快的，就几个小时，耗了近30%的电其他没啥说的，除开待机，整体来说还是挺满意的，总之就是好好好好好好好好好好好好好好好好,5
vivo的售后气死人，还没入手的建议考虑其他品牌的吧，使用一天，特来追评，真实体验如下，耗电比飞机还快，一个，正常使用一小时就耗电10%，下午四点充满，晚上就剩50%，待机放到第二天早上就剩30%，我用了三年的旧手机耗电量也没就这么差吗，这以后还怎么敢再入手vivo了，真是气死了，,5
手机买回来有十来天了，此款手机照相非常清晰，蓝色的非常适合男生，机身纤薄，手感好，性价比高，用了这么多天手机也没有了卡顿的现象，充电速度也比较快，此款手机买得比较中意。,5
S9的朝露白可真的太好看了。还真有点早起出太阳的意境。个人觉得比印象时光内个五颜六色的灰好看。屏幕是齐刘海，像素贼高，照亮了我的美，哈哈哈哈。,5
手机收到了，，给老婆买的，颜色非常漂亮，老婆很喜欢，拍照功能多，拍的照片清晰度太好了。处理器也是联发科高端处理器，运行流畅不卡顿。,5
手机非常漂亮，第二天就到货了，京东物流很给力，开机设置玩基本配置后，感觉系统很强大，功能也很多，很人性化，值得推荐一下,5
外形外观：高档大气，手感舒适。拍照效果：美美哒，再也不用担心拍照不好看，每一张都是高清靓丽。帅气的我～运行速度：超级快，12+256，爱了爱了！！！,5
外形外观：外型粉蓝色适合女生，梦幻蓝适合男生，后背菱形设计，美轮美奂.屏幕音效：6.44屏外观大气富有美感.适合看电视看小说，两不误拍照效果：前置3200万高清美颜自拍，后置4800万拍照景物清晰明了运行速度：8g?128g运行飞快，再用两年没问题待机时间：待机不同的情况下单纯待机，2天没问题其他特色：真的很美，推荐购买.,5
这款手机颜色太漂亮了 玻璃后盖绝绝子 颜控表示很喜欢！拍照也很好看 电池也很耐用！,5
朋友都说我手机拍照好看，拍合影都让用我的手机哈哈,5
外形外观：外观很漂亮，一拿到手就喜欢上了。拍照效果：拍照效果很好，尤其是拍的夜影超好看。运行速度：而且手机的运行速度也很快，一点都不会卡顿。待机时间：待机时间长,5
618给自己买的，也体验了一段时间，手机是真心不错，像素很好，是一款不错的拍照手机。朋友说也想换手机了，我还推荐了这款，性价比还是很高的。,5
机型中规中矩，12+256的配置运行相当流畅，完全不用担心内存不足的情况，显示效果很好，尤其是拍照功能很完美，推荐购买。,5
可以很快很好不错清晰用vivo牌子的手机用了很多年了，一直都挺好的，手机颜值爆表，电池也耐用。就是4G手机卡了换个5G手机，这样用起来流畅不卡，总之以后会一直用vivo的手机   非常棒的一款手机   值得拥有,5
给老婆买的，老婆很满意，不愧是最强自拍手机，后置摄像头也不错，手机小巧，618活动很给力，如果喜欢自拍，选她错不了，用以后会追评，京东客服很好！,5
之前的一部手机也是vivo的，用了四年多，有点卡顿，看到有活动就下手啦，挺不错的，很喜欢，快充接口，充电很快，使用起来很流畅，拍照?效果也很美，还赠送手机壳，特别喜欢，而且也支持5G，很漂亮，电池续航能力强,5
被Lisa种草的，又get到了新自拍技巧，发货挺快的，很快就送到了，这款手机颜值还是很能打的，这次新增了双极夜柔光灯，夜间自拍很惊艳，不愧是自拍机王,5
拍照很好，音质也不错。新运行流畅，电池耐用。一部各个方面都很优秀的自拍手机。,5
手机很薄，日常使用速度很快，不玩游戏所以不知道游戏体验怎样，是目前最轻薄小巧的手机了，女生用很好，拍照也比较真实，和我的v30pro比拍照强不少，自拍更不用说了市场上比较这个价位最强者，非常不错。,5
外形外观：外观好看，梦幻冰岛之恋，手感很好屏幕音效：屏幕很大，看电视玩游戏都很适合拍照效果：非常清晰，自带美颜效果运行速度：很快待机时间：蛮长，充电也快其他特色：装很好，有防爆袋和密封条，赠送的运动蓝牙耳机好喜欢，赞?手机感觉还不错，使用一段时间后再来追评。,5
电池很耐用，拍照很清晰，空间也够用！,5
外形外观：高端大气上档次拍照效果：效果非常棒！专业级别了，功能太多还需要慢慢研究，拍出效果更好的照片运行速度：空间大了，就不会卡了，速度快了好多其他特色：闪充好，音效好，希望服务也一如既往地好,5
手机无论外观还是性能都很好，颜色我超级喜欢，顶级的配置，价格平民，24期免息，无压力。,5
刚上市就抢鲜体验了，包装很好很美观，外观颜值特别高尚精致，就是喜欢这样边框设置。天玑1100配12+3的运存速度可是杠杠的。屏幕手感很好很流畅，后6400万+前4400万像素拍照效果更是没得说了，总体来说很是喜欢满意。,5
外形外观：外观特别的美，中规中矩，又很薄，手感很爽屏幕音效：声音很大，很饱满，音色清脆拍照效果：拍照没得说，本来就拍照手机运行速度：运行很快，并且还可扩展内存,5
外形外观：非常漂亮！淡紫色有种低调奢华的美。屏幕音效：随意试了一下机，很不错，声音外放很大，不嘈杂。拍照效果：拍照效果真心喜欢！随手一拍都是大片！特别夜景拍出来人脸效果非常好！运行速度：下载了几款常用APP，速度飞快！本人现在用的手机已经慢的不行了，跟这款手机一比，感觉这款手机6的飞起！待机时间：关机状态下一天，100%的电，还剩94%，开机状态还没试。其他特色：正在试用中，因为是第一次用vivo手机，希望能够带来惊喜吧。,5
特意使用了一段时间才来评价，这款手机真的挺不错，操作流畅，满足日常使用，而且手机非常漂亮，拍照效果很好！用电比较快，但是充电也快，不错了！,5
外形外观：外观很厚实，有分量。屏幕音效：清晰度很高，音质响亮。拍照效果：所有手机里面vivo手机拍照效果最好好的啦！运行速度：运行速度很流畅，没有卡顿的情况。待机时间：超长待机，充电超级快。其他特色：送给老婆的，老婆十分满意，手机非常好，京东快递依然十分给力，超级赞?,5
手感外形外观：大气上档次屏幕音效：悦耳、动听拍照效果：好看，清晰运行速度：快,5
给儿子买的，很喜欢，屏幕大，看视频方便，速度快得很，内存够大，超级快充，很洪门,5
很漂亮，颜值满分，手感也很好！屏幕音效：非常不错！拍照效果：超级清晰！不愧是拍照手机！满足了日常所有的拍照需求！运行速度：不错！外形外观：美到爆炸的颜色！漂亮！待机时间：充电速度快，满足日常需求没问题！,5
拍照效果：拍照非常好，和同价位的红米k40Pro比较了一下，没得比。三张照片前两张没有灯光拍的，第二张微距，第三张亮光，第四张这个手机的颜色。待机时间：玩了一个下午耗电30左右运行速度：目前看来还行，基于我不打游戏外形外观：超薄且轻,5
手机很好用，vivo像素特别清晰，打游戏不会卡，打王者荣耀，和平精英全开都不会卡，可以用5 g网络，信号很好，电池持久。很喜欢,5
手机已收到，打开后感觉很惊艳，首先外形方正，外观漂亮，是我很喜欢的款式。7.35mm的机身，手感轻薄舒适，拍照很清晰，尤其是自拍，不愧是轻薄自拍旗舰机，手机音质也不错，运行很流畅，是一款性价比很高的手机。京东自营的，物流速度快，服务态度好！,5
手机用了几个小时了，待机时间不错，充电也很快，使用中一点也不卡顿，子夜蓝的颜色也显得手机美观大气！,5
第一次看这个S9就很喜欢了，奈何老手机一直没坏所以也不舍的买新手机，现在终于买到手了，老手机可以丢啦哈哈，外壳和设计都是老婆喜欢的，很绚丽，拍照也好看，够清晰够美颜，希望耐用一点，争取三年不换手机?,5
颜色很漂亮，拍照效果较好，很清晰，运行速度：运行速度很快，12g的待机时间：待机时间挺长，总是看视频，能用一天半时间。其他特色：可以自己设置的东西很多,5
丰常棒的一款手机，快递速度很快，手机超薄型，外观也很美，充电速度也挺快的！最爱的就是它的美颜了，真的是像素超级高，怎么拍都是好看的，爱了，价格方面也很美丽呦！,5
这款手机颜值没的说，非常好看，手感也是不错。使用感也是很好，流畅速度也快，当然本身游戏也玩的少。相机就更不用说了，照什么都好看,5
给老婆买的、主要是老婆不喜欢太大又厚重的手机，这款尺寸小一点、也更加轻薄一点，外观设计非常时尚、更显质感。玩了一下午，整体手机非常流畅、拍照清晰，拍照上的功能也更全面。整体来说非常赞！,5
京东服务和物流点赞，使用几天了，手机质量还可以。出厂居然没有标配手电筒软件！工程师脑子干什么的！在应用商店下载个手电筒软件，又是一堆广告，太e心了！,5
总体感觉值得购买。运行速度：性能不用说了，很流畅。拍照效果：前置摄像头不用说了，搭配前置补光灯，再暗都可以。后置摄像头远超我预期，室内弱光完爆米9se令我比较惊喜，这是到手前评测普遍提到弱项。外形外观：颜色非常出色，很好看。机身轻薄，三围小。屏幕音效：还支持高刷，虽然不知道有什么用。,5
预定全额付款成功后，说12号会安排发货，结果等了几天，但我是理解的，因为此款新机太多人抢购了。此机颜值非常高，太讨人喜欢了，拍照效果很好，尤其是喜欢自拍的人可以入手了，哈哈！充电也很快，本人不玩游戏可用1天多。,5
第一次用vivo，机身超级好看，太适合女生用了。一点也不输老公的X60，自带的手机膜和手机壳，手机壳是软的，很好看。国产手机，值得拥有,5
今天收到宝贝，马上试用，好用，外观好看大气，手感很好，拍照片清晰，待机时间长，充电速度快，快递服务好，整体很满意,5
老妈现在的手机用起来有点慢了，打算给老妈买一款手机，这次618来选了选，最后定了这一款。手机美观大气，到货后我专门用了几天看看效果在决定要不要这款，果然没让我失望。待机拍照运行效果都不错。手机调试好了没啥问题后就给老妈了，她很喜欢，我也很满意。,5
外形外观：好看，黑色的手机用多了，换个白色很好看，最近很喜欢白色屏幕音效：很好，屏幕显示很好拍照效果：不错，日常拍照还是很够用的运行速度：可以，买了最大运行的，希望可以用久一点待机时间：可以,5
外形外观：美丽大方屏幕音效：音效不错拍照效果：那是相当的强运行速度：灰常快的待机时间：电池容量很大其他特色：大屏幕，大容量，拍照超强，适合我妈玩,5
外形外观：好看，颜值高，清新屏幕音效：清晰度好，音效好拍照效果：广角大，照的相片全面运行速度：快待机时间：长其他特色：充电快,5
比较不错。颜色很正。价格也便宜。手机拿在手上手感也还可以。拍照相素也很好。满意！,5
