评论,评分
京东物流就是又快又省心，安全送到。手机很漂亮，媳妇很喜欢，颜色也很适合女性。刚开始有点费电，系统升级之后就很耐用了。系统界面很简单，操作方便，跟华为不太一样。性价比也不错，用过一段时间再来追评。,5
买了送老公买的，上午下单，晚上就收到了，像素很高，拍照还有自动识别食物 人物功能，拍出来的照片很好看！值得推荐！,5
外形外观：很漂亮，很喜欢屏幕音效：还不错，能满足日常所需拍照效果：很好运行速度：很快。待机时间：至少一天吧，我不怎么玩游戏，只追剧其他特色：很新鲜，不枉费等那么久,5
外形外观：我超喜欢的外形，超薄，手感很好拍照效果：很清晰，也没虚影屏幕音效：屏幕很大，全面屏就是好其他特色：目前使用情况就是，手感好，屏幕大，音效很好，超薄很漂亮,5
反应特别的机型、手感都特别的好，非常喜欢，运行速度也是非常的理想，价格还是蛮合理的。,5
个人觉得vivo的这款手机很nice，买手机不需要比来比去，适合自己最好，手机买来送给老婆的，和蔡司研发的镜头，三星5**处理器，超薄机身，org系统，微云台，33W双擎闪充速度可以的，3499可以了，主要是24期免息呀，买就完了。,5
手机还可以实力遮住了双眼，其实vivo X60在其它方面的表现同样也是很不错。就拿外观颜值上来说，170g的机身重量+7mm+的厚度，使其成为目前5G手机中最轻薄的一款手机，在手感方面是真的无可挑剔。而且，vivo X60系列还有OriginOS系统加持，在系统可玩性以及流畅性方面，都是达到安卓UI第一梯队的水准。,5
等x60等了很久，一发布就预定了。京东物流很快，晚上发货，第二天早上就到了。手机很轻薄，握持感很棒，120hz丝般柔顺，背面颜值也很，拍照跟蔡司合作应该还不错，总之很满意。,5
在x60和iQ7之间纠结很久，最后还是选了x60，到手之后外包装就很惊艳，手机很轻薄，拍照功能确实太强大了，夜景功能也很好，而且用自己手机可以拍自己手机，再就是打王者，试了一把还不错，其他功能还在尝试中，不错,5
帮战友买的，他说很好，这款手机颜色真的很漂亮，不仅轻薄而且颜值超高，手感也不错；拍照效果真的很强大，拍出来效果很自然，屏幕显示效果清晰，音质也不错。充电很快，电容量也很大。体验感非常不错，总体来看性比价高，值得购买。,5
vivo新品，必入的一款，机身大小，厚度都刚刚好，挺满意的，尤其是微光这个颜色太赞了，拍照功能强大，很喜欢的一款机子,5
拿到手里只能说惊艳，云台相机特别稳，配合f1.6的光圈和不错的感光底，拍照很稳，很满意，价格也能接受。推荐喜欢拍照的人购买。颜色也不错，不沾指纹。很满意,5
这款手机挺不错的，还是很满意的，拿在手里特别舒服，手感特别好，相素素好，内存大，反应快，充电快。666666,5
给老公买的，他说信号比以前的好，屏幕清晰度很高，也比之前用的vivox23好多了，一直都是vivo的忠实粉丝！,5
颜值在线，拍照非常强大，和我p20pro比起来好太多了，父亲喜欢手机拍照，这款正合适，不管人像和风景都很强大，效果很惊艳，这下日常出游不用带单反出门了，很棒哦！,5
再上几张图！,5
手机速度快，一直用这个牌子。照相超美，超薄，质感好，一切完美外形外观：外形外观：超 薄屏幕音效：很棒拍照效果：美美哒运行速度：超快,5
外形外观：是我喜欢的外形，很漂亮屏幕音效：非常好拍照效果：清晰完美是我很喜欢的一款手机,5
比较了多个品牌同价位的手机，女生，不玩或少玩游戏这款我认为是性价比最好的一款，到手也很满意。使用流畅，手感很好，女生用着也不重。到手不会累。,5
发货速度快，外观漂亮，手感不错，特喜欢拍照功能，夜景拍照效果超好，是旅游的好伴侣，期待旅游大片,5
物流速度快，手机颜值很高，非常满意，打游戏棒棒哒，速度非常快，不会卡顿，大爱。,5
到货速度很快。包装完好。背壳很好看。很轻薄，电池续航还可以，开机后有35%左右的电量，不到1个小时充满。,5
这手机外观特别好看，7mm多很轻薄，手感特别棒。三星5**处理器，配合高刷很顺畅。蔡司摄像，照亮你的美。,5
这款手机颜值相当可以啊，相比于x50，轻薄很多，大小尺寸也刚刚好，比较适合女性同胞们，蔡司镜头，像素可以，拍照很好看，总之很满意！,5
外观没的说，好看，手感也很好。拍照真的很可，蔡司镜头牛?新系统也是蛮好玩的总体来说很流畅，用着很舒适，没什么槽点。,5
手机观很漂亮，质感也不错拍照功能清晰，夜景拍照效果很好 非常喜欢?,5
一直用vivo，好多年好几代了，感觉很好，符合人体工程学。,5
一直都是咱家的老客户，从最初一直支持到现在，手机非常的喜欢，外观漂亮，拍照是第一流的，内存大，用起来顺华也不耗电，简直是100分，下次还会买，希望越做越好。,5
外形外观：很漂亮，微光颜色好看屏幕音效：触感很棒，拍照效果：没有很惊艳，可以接受吧运行速度：很好待机时间：重度使用可能一天得两冲其他特色：还在体验中,5
现在京东买手机质量这么差么？？？买来不到十天，屏也碎了，送的快递也不是京东的，我就觉得奇怪，买的新品手机啊，快递不送上门，这么贵重的手机的，所以快递就给了我一开始不好的印象，再接下来就是使用感非常差，卡，信号网也不好，还不如原来的旧手机，再后面就是手机屏也摔了，这是我购买手机唯一一次体验感非常差的，而且花的还是钱最多的，真是非常不满意！！！所有不好的问题都出现，也是醉了！,5
外观精致漂亮，屏幕清晰，音效很好，拍照清晰，之前就使用的x27，感觉很好，运行速度非常快，待机时间正常，容量大，适合我存储大量照片视频。,5
提前收到了，很满意！颜值很高，喜欢，运行速度快！电池一天一充吧！刷视频，没有玩游戏！,5
款式不错，样子好看，拍照和音乐效果也都挺好的。对比了华为nova8，小米11、10，最终还是选择了这款，除了配置，还有这款的颜值确实高，还有重量也很轻，希望用一段时间能有好的体验吧。,5
外形外观：大器屏幕音效：很大，很好拍照效果：超级好运行速度：超快待机时间：一天半左右其他特色：超喜欢，黑色超大器，是我喜欢的，很满意，越快的一次购物,5
手机外观漂亮，拍照效果特别好，超级月亮好好看，运行速度快着呢，待机时间还不错，平时就是聊聊微信，看看视频，一天冲一次电，很正常，不玩游戏，所以没有什么发烫的问题,5
早就看好了，一直忍到618才下手，要了个256内存的，听说内存大了不卡，刚拿到手机很兴奋，外观好看，屏幕很清晰，超薄，打算以后就用这个牌子了，老公用的这个牌子，很好用，用了3年没出毛病，也没有卡顿，挺好！,5
京东的以旧换新活动换的手机，把原来的苹果XR置换了，方便又划算。这款X60机身薄，重量轻，操作方便。非常喜欢X60的拍照功能，夜景也拍的非常清晰！,5
第一次用Vivo这个品牌，手机设计和做工确实很美，拍照惊艳，适合女士用。速度，声音等也够用，质量待时间考验，本来想买Pro，但觉得还是标准版性价比高。后续用的好再追评。,5
总体感觉不错，系统运行流畅，照相效果很好，没用vivo x60 pro版，不知道区别大不。等着再出超大杯,5
手机颜色很漂亮，运行流畅，玩游戏也不卡，照相机像素高，用了几天体验很好。,5
从x9开始到x60一直选择vivo，品牌值得信赖，拍照也清晰，手感舒适，非常给力，以后会一直选择vivo,5
非常不错的一款手机，尤其是拍照效果很不错，第二次买这个品牌的手机了。,5
首先，京东自营的ViVO送货极速，这点非常好，这款手机配置高120HZ高刷屏率，8+258双高内存，音质更不用说，ViⅤO手机的音质一直首屈一指。家里有人一直在用VivO手机，这次又换同品的，是对ⅤiVO最好的肯定，总之非常满意。,5
拍照的质量非常好。不愧为蔡司的技术。,5
最满意：材质好，颜色好看，拍照清晰，续航能力强最不满意：没赠品做工外观：外观好看，手感不错配置性能：玩游戏不发热系统流畅度：系统运行流畅拍照效果：摄像头60倍拍照特别清晰其它描述：平时比较喜欢拍照就买了，这个摄影功能也比较强大，比如这个超逆光夜景人像，拍出来不仅清晰，还很有感觉，夜景模式还有好多种，最爱的还是这个自拍超级夜景，爱不释手，电池相对来说也比较耐用，拍照修图看视频什么的轮番来也都没问题，专为拍照而入的手机，完美。,5
外形好看，音效立体感强，拍照效果好，运行速度快，待机时间长，闪充电，棒棒哒！送给老公作为新年礼物，他很喜欢！,5
用啦一礼拜，反应挺快，一直用vivo的手机，确实好用，晚上十点五十二下的单，第二天中午就收到啦，这速度太惊喜啦！一直比较信赖京东！希望京东越来越好！,5
外形外观：薄精致，屏幕音效：屏幕流畅拍照效果：拍摄效果好，快视频慢视频微拍运行速度：快待机时间：很好其他特色：颜色漂亮好手机，配置高，,5
外形外观：非常漂亮，完美屏幕音效：清晰，非常棒拍照效果：无敌了运行速度：非常快，一点都不卡待机时间：大容量电池，不担忧其他特色：支持国产优秀手机,5
虽然是五一期间买的，但是两天就收到货了，物流很快。机子外形很漂亮，玩游戏也很流畅，特别是拍照特别清晰，耳机也很给力，就是耗电量有点大，如果续航能力再强点就好了。用的来说还是不错的。,5
手机特别轻，运行速度不错，****功能挺好用的，系统带的主题萌萌的，适合女士使用。总体给个好评，这个价格给力。性价比太高了。5**的三星处理器带劲儿。,5
网店的活动很给力呀 618下单 三千不到一点入手的。会员还额外送了耳机。目前用着不错,5
颜值很高，很薄，手感好，照相特别清晰，拍摄***有云台加持很稳，棒棒哒。充电速度快。,5
"很信赖vivo,刚刚替下来的就是vivo，用了5年，质量没得说了，性价比很高，选这个型号是冲着蔡司选的。用了几天没有发现什么问题，好评。",5
我们全家人都在用vivo手机，从Y66到x9到&times;21到现在的vivoX30的这款5G手机，手机机身非常漂亮，运行内存八个G，运行速度快，音质音量好，拍照效果特清晰。我们全家人都是vivo的忠实粉丝。京东物流非常的快，全五星好评。,5
从vivoY66到vivoX9到vivoX21到vivoX30，上面的评价有个字写错了??,5
家里的手机都是VIVO的，X60发布时买了一部华彩的，觉得不错，性能、拍照、颜值都是同级别最好的，这次有货又买了一部微光的，同样很好,5
外形外观：很漂亮，外观高于苹果?拍照效果：镜头不错，功能强大，264g挺好?够用了！运行速度：挺快的呢炫彩的好看整体效果不错，支持国产的,5
屏幕大小挺合适的，直板屏幕，看着挺舒服，高刷新率120，适合刷视频，拍照云台的确很牛，夜里可以拍出很好的照片。,5
用了几天，各方面都还不错，用起来也很顺畅，夜间拍照很好看，拿手上重量刚好。暂时还是满意的。,5
种草x60很久了 给父亲买的 充电耗电手感都比较人性化 屏显和照相很奈斯 原包里有充电器和耳机 整体好评,5
经常看到x60的广告，正好手机该换了，就入手了。送货很快，第二天就到了。目前用了几天了，感觉不错，外观惊艳，系统也很流畅，照相功能还没体验～,5
非常喜欢，外观美观大方，大气庄重，物流也很快速，很薄不重,5
收到货了，包装完好没压到。生产日期也挺新的，是今年四月份生产的，手机颜色很好看，后盖是渐变色的，在不同的灯光下，照出来颜色是不一样的，现在买还赠送半年延保，质量有保证，拍照也很清晰，还有美颜功能，手机各方面都操作挺流畅的,5
外形外观：机身很漂亮也很轻薄，颜色很好看特别好拍照效果：拍照效果真的不错，拍云都能看的出层次好好哦，旅游真的太喜欢拍美景了运行速度：运行快，赞待机时间：出门时也不用太担心手机没电，待机时间真的很理想哦,5
屏幕不算大 正合适！！拍照贼清晰！！！！而且颜色也不发灰 运行特别流畅！手机很轻  玩的特别顺手！！！绝了！拍照效果：拍照真的贼好，比旧手机荣耀要好太多了屏幕音效：听歌党爱了！！,5
外形外观：漂亮。美观。手感很好屏幕音效：这个改变倒不是很大，。拍照效果：效果很好，清晰度也很不错。,5
屏幕大小合适，速度很快，照相也很好用，第一次使用 这个品牌的手机，感觉很好。,5
漂亮屏幕音效：清晰拍照效果：微云台太好用了运行速度：流畅待机时间：才玩一天，看不出来其他特色：手机很漂亮，别的都是其次，白色太漂亮了外形外观：漂亮，轻薄,5
Ⅴivo，x60很好，不止一次购买了，很好用不错的一次选择，质量杠杠的，五星好评,5
第一次用vivo手机，X60外观好看，拍照效果特别好，运行快，真的很好用，值得拥有，物流很快,5
各方面都挺好的，这两年vivo得系统进步也很明显，就是游戏模式，小窗功能很鸡肋，希望多多完善，能像flyme或者miui那样就很好！vivo各方面进步是明显的！,5
第一次购买vivo手机，手机拿到手了很喜欢啊，手感很好，很轻薄，微光颜色很好看，很值外形外观：喜欢拍照效果：拍照功能多样，蔡司摄像头很棒,5
第一次买vivo的手机，外观漂亮，做工不错，显示效果好，面部识别很快，UI还要适应一段时间，指纹位置如果再高一点会更顺手,5
X60比较轻薄，手感好！手机背面颜色炫酷！处理器速度很快！拍照效果杠杠的！,5
物流很快，昨天拍的，今天中午就到了，，手感不错，怎么觉得电池不耐用呢,5
宝贝收到非常喜欢，照相效果不错，手机手感很好手机颜色好看,5
手机收到了，特别喜欢，像素比原来的手机清楚多了，反应很快，人脸识别很灵敏。,5
外形外观：颜色挺好看的，手感也很轻盈拍照效果：拍照效果清晰，也不会用什么高端的，还在探索中运行速度：运行稳定，日常肯定够用了,5
屏幕清晰，色彩还原准确，5G网速超快，拍照清晰，功能强大，很值得购买的一款产品！,5
手机用了一段时间了。感觉很不错。云台防抖很好，拍出来的照片美美哒，手机耗电也能接受，用了一条玩的不是很厉害还有电，玩游戏也不卡顿，总体来说，手机评价不错，一直用的vivo比起某为，为卖爱国情怀加价卖好太多了。精挑细选很久?，最后决定买这一款?，到货后果然没有让我失望，实物很漂亮?，做工很精细?，特别满意?,5
手机很很漂亮，很喜欢，但是电池不耐用，拍照还是可以的。,5
已经用了一个月了，手机非常好用。特别是拍照很清晰，以前给孩子拍照孩子一动就拍不了，但这个手机完全没问题，一点不糊。总之非常满意，充电也很快，充满用一天没问题。,5
手机很不错，发货快，颜色也很好看，用着很顺手，趁着618入手价格也有优惠，非常不错,5
外形外观：外观时尚大气，屏幕音效一流，拍照不错，8+256运行速度快，待机正常，充电速度超快。一共买了两部手机,5
拍照效果满意，广角非常好用，即使逆光也很清晰，高饱和厉害，适合拍拍拍,5
终于等到了.x60特别好.老婆一直vivi的手机，像素很好，质量可靠，听音乐也特别棒。颜值担当性能无敌拍照效果特别好以后还会用vivo,5
手机非常不错，画面清晰，反应灵敏，速度快，非常适合女人使用,5
第一次买vivo手机，看网络介绍和评价都不错，收到打开首先感觉外观质量做的不错，华彩颜色很好看，屏膜已贴好，送了保护套，很贴心。使用效果待用过一段时间再追评。,5
没想到第二天就能收到，发货真的很快，手机颜值高，非常的轻薄，拿在手里非常舒适，试了下拍照真的非常非常清晰，使用起来非常的流畅，速度非常快,5
外形好看轻薄，之前用的x20，比20拍照各方面升级了很多，自带美颜拍摄的都不用再修图，其他很多功能也有升级。,5
外观非常好看，包装高大上，手机里面的原子音乐音质也好。外形外观：漂亮拍照效果：挺好运行速度：很快。,5
心心念念的X60终于到货了，京东商城配送速度真是没得说，手机太漂亮了，很纤薄，手感非常好，照相效果一级棒，还赠送无线蓝牙耳机，太好了???,5
很轻巧，颜色也很好看，很喜欢，比较喜欢这种简约的风格，很百搭。,5
X60手机收到货了，三天就到了，手机不错，用着方便，运行也很快，vivo手机一如既往的好，做工很好，摄像拍照也很清晰，X60爱了。,5
外形外观：很轻薄，颜色很漂亮，手感很好屏幕音效：显示效果很细腻，色彩舒服拍照效果：蔡司出品，没得说！运行速度：流畅待机时间：终于不用老想着充电宝了,5
颜色真的好看,5
还可以，样子不错，也很薄。下了几个软件，有些烫，过一会儿好些了，充电很快，希望能用得久一些，京东的物流真快，我凌晨拍的，中午就到了，,5
买的第二部x60手机，第一部给老爸买的原力黑，这部微光，颜色很柔，珍珠般炫目，非常适合女生使用，如果不是镜头没保护，真的舍不得戴壳???系统很好玩，安卓机界面的DIY性很强，大时钟大日历很适合老年人??????我自己的备用机本来准备等nova8pro有货入手的，现在有点犹豫要不要直接入x60pro了???,5
手机形状外观设计手感不错，下载速度很快。拍照效果一流，充电时间很短。,5
手机包装很到位，物流贼快上午下单晚上就到了，送给妈妈的春节礼物，手机漂亮轻薄，妈妈特别喜欢，屏下指纹解锁面部解锁都很好用，照相功能强大,5
收到了手机，朋友买的感觉还不错，挺漂亮的，暂时性用着还可以 ，至于后期使用好不好之后再看 ，当前很不错，这个品牌我买了好几个手机 了。,5
第一天下午下单第二天下午就到了，京东的物流杠杠的没话说，手机买来当作生日礼物送给父亲的，之前父亲那台vivo    X20用好几年了，手机反应很慢了，这次趁着生日给他偷偷买个新的，网上找了很久，对比了各大友商，感觉还是X60主打拍照的款式比较适合他，而且不须要重新适应新的操作系统，****后，马上就能用，开箱后看到手机觉得太惊喜了颜值真的高，上手试了一下很流畅，拍照也很好用，父亲很开心看得出他很喜欢，最后希望京东//vivo都能越做越好,5
x60这款很好用  之前用的是x21  x系列的都挺好用的相机拍夜景很美  反应速度也很快  掉电不快  总之很满意  国产机越来越好啦,5
快递速度非常给力。包装完好，无损坏。刚上手，目前用起来感觉还不错。,5
外形外观：好看拍照效果：清晰真实 非常不错其他特色：递迅速不足之处是 充会发热 耗电快,5
外观设计风格非常好看，屏幕分辨率清晰，拍照清晰，运行速度流畅，待机时间有待考证,5
手机真不错，高端大气上档次，拿到手上很有质感！拍照一流！,5
外形外观：轻薄，后边颜色相当高大上拍照效果：不错的，就冲这拍照效果来的！有些功能还得慢慢研究！运行速度：很快，空间也足够用的！待机时间：一天差不多！我觉得还可以得了！,5
vivo这款手机最直观是5**制程的三星旗舰芯片，超越了骁龙865plus，配合最新的ufs3.1闪存，使其拥有超流畅的性能体验，4300毫安的电池加上33瓦闪充组合，日常续航足够厚实。,5
超级美，颜色真的爱了，太适合女孩子的少女心了，画面比x21好很多，拍照里面还有各种姿势选择，解决了面对镜头不知道摆姿势的尴尬，太适合女孩使用了，这是我用的第三部vivo了。,5
物流好快呀，一天就到了拍照效果：拍照挺清楚的，美美哒，内存大，喜欢这一款待机时间：待机时间满长的，外形外观：拿着手感舒服?，薄薄的呦，建议友友买，超值得,5
京东发货很快，外观非常漂亮，性能太强悍，系统非常流畅，待机时间长，屏幕清晰，拍照满意真的很好总。客服服务也很好，总之满意！赞赞赞！,5
一直想买一款拍照手机，看了好久，也对比了好久，最后选择了x6，特别喜欢它的摄影，目前来说，它是拍照最好的一款手机，续航能力强，搭配65w的充电器，充电方面，没得说，喜欢的小伙伴可以下手了，物流很快，我头天买，第二天就到了,5
自己买一台，第二天又买了一台给家里人，家里人拿到货可开心了！原来用的苹果机，想了好久才决定换这个牌子，果然没让我失望，拍照超级清晰，而且还会自动识别是否夜景，充电和运行速度也快，爱了爱了,5
因为疫情原因 差不多一个多星期我才收到 迫不及待拆开外包装  手机包装盒惊艳到我了 磨砂质感还闪闪发光 里面手机也好喜欢 选的微光 手机很轻巧屏幕也大 手机也很薄 反正就是很喜欢 还换上了自己喜欢的手机壁纸 爱得不得了?,5
外形外观：颜值很高 极其轻薄 拿惯了之前的手机 再拿这部手机都得小心翼翼的 生怕滑出手屏幕音效：120赫兹刷新率很舒服 没毛病拍照效果：微云台拍照很稳 至于其他的 本人很少拍照 没去刻意体验运行速度：8+3g不是吹的 应用多开也不卡 也不杀后台 很棒待机时间：待机时间有些短 可能是为了手机轻薄 牺牲电池容量了其他特色：最让我眼亮就是origin os了 这点也是促使我买这部手机的原因 用起来真的很方便 极力推荐,5
刚买的vivo X60手机，感觉真不错，超级满意，买的黑色的，超乎自己的想象，新款的感觉比之前感觉反应快，屏幕清晰度强，强烈推荐，希望大家可以试一试！,5
外形外观：外形美观大气，机身厚薄适中拍照效果：拍照效果很好，人像更柔和自然，夜景拍得十分清晰运行速度：暂时挺好的,5
嘤嘤嘤嘤！！！！不错不错，物流很快就到货了，拍照很给力，骁龙768G用起来很流畅。新系统奥利给看起来很简洁直观！好用。,5
又一次买了vivo手机X系列，这手机外观外形简直太漂亮了吧，，拿着轻薄方便，舒服，功能也棒棒搭，超强夜景，棒棒哒,5
第一次购买vivo手机。同事推荐的，vivox60，相对性价比较高。8g+256g，三星芯片，蔡司镜头，微云台拍照不虚。使用起来手机不卡，运行速度快。原力色，庄重大方。京东送货的速度特别给力，服务质量好。,5
手机很轻，机身也很薄，颜色很棒。礼盒装也是十分划算了，赠了一件L吗的卫衣。3000多的价格，很合适了性价比。值得购买。拍照效果也不错的。,5
整体感觉很满意，发货速度很快，物流也很快，调货也只隔了一天。手机很轻，手感超棒，画面很好，系统也不错，指纹之类的使用下来也都很棒。原装的保护壳很紧，但不是很防摔，建议购买的时候顺带买一个防摔一点的。,5
外形外观：外形外观非常漂亮屏幕音效：屏幕音效非常完美拍照效果：拍照效非常清楚运行速度：以前说的非常的快，一点都不卡待机时间：待机时间，早上8:00到晚上11:00，还有40%的电。其他特色：外形，外观，做工非常完美。整体看上去还可以。,5
外形外观：外观还是很不错的，比较符合当前的潮流屏幕音效：新手机用的还是很流畅拍照效果：拍照比较厉害，毕竟还是主打功能待机时间：待机时间多少差点意思其他特色：拿着很轻，手感不错,5
一直用蓝厂手机，妈妈的x7用了四年，该换了，正好x60刚出，配置更好更新，果断入手。买的礼盒装，多几个公仔和贴纸，手机很完美，算是国产手机顶级实力了吧。,5
用了一个多月了，超级喜欢，手机像素特别好。连月亮的纹路都拍得出来，准确地说是月球,5
