评论,评分
性能与性价比并存不错的手机手机外观很漂亮，颜色也很好看，充电的速度真的给力，界面美观，拍照效果清晰，待机时间长，手机运行流畅，功能强大，充电很快 ，四十分钟就能充满，屏幕画面清晰，摄像头很清晰，昨天下单，今天就到了。,5
厚度不是很厚，不带套的话手感很好，就怕摔了，没有买保险就亏大了，这价格很实惠了，物超所值，商品设计完美，外观也很高大上，让人爱不释手。客服更是热情的没话说，这次购物很满意,5
反应很快，用了差不多一个月了，像素也够用了 千元机扛把子，非常的不错,5
给老爸买的，超级好用不说，性价比真是超高，大屏幕高分辨率，续航时间很长，听歌音效很棒，拍照清晰，五运行速度快，老爸非常满意,5
第一次买首发机型，看中的就是iQOO Z1的超高性价比：&ldquo;iQOO Z1首发天玑1000 Plus旗舰芯片，采用领先的7**制程工艺，搭载A77+G77处理器内核架构，CPU主频高达2.6GHz。全球首发支持5G+5G双卡双待，支持Wi-Fi6，还有双Wi-Fi智能网络加速、6频双模5G，麦克斯韦天线系统。搭载了4500mAh超大电池。搭载了44W超快闪充，23分钟充电50%。超级液冷散热系统，手机核心温度直降10℃，保持手机冷静。&rdquo;再加上京东首发不错的价格，虽然联发科这颗CPU还没经过验证，但是还是入手了，希望性能与宣传的一样给力，机器整体感觉还是不错的，用一段时间看看怎么样。。,5
今天已经收到手机刚用了一下不错，挺喜欢我用反应非常快，下次还继续,5
很好非常喜欢,5
iQOOZ3云氧8+128手机，选机时就看了好一阵子，拿到后确实很漂亮，很喜欢，颜色图片视频都很清晰，如此靓机怎不喜欢,5
用了几天才来评价，手机外观漂亮，屏幕清晰，运行速度快，夜间拍照效果非常好，玩游戏不卡,5
这款手机，性价比高，功能强大：拍照效果狠不错，外观时尚漂亮,5
vivo手机。质量非常好，做工非常精细。附送的耳机，音质也非常棒。打游戏手感，非常的好。一点不卡。而且手机也不发烫。长时间打手游。都不发烫。处理器的散热效果处理得非常好，非常满意，愉快的购物体验。,5
手机很轻薄，拿在手里很舒适，虽然是千元机，但骁龙768g性能还可以的，日常使用流畅度很不错，手机系统非常简洁好用，有很多人性化设计，之前一直用MIUI，这次尝试origin OS也非常不错。性价比方面真的超高，55w快充，高刷，这些以前高端机才有的配置都有了，体验大大提升,5
外形外观：简单大方屏幕音效：音效比我想象的差一点，但是对得起这个价格了拍照效果：拍照挺好的，像素很不错，夜景的也很好运行速度：运行很流畅，因为是给母亲大人买的，她我用的app少不怎么会影响到运行速度待机时间：经过这几天试用，在开机连接无线的情况下，是待机一周以上，偶尔还听歌的，所以待机速度很好,5
手机跟想象中的一样，很不错，全套（额外快充和耳机），使用了一天整体很流畅，还可以增加内存，装了二十来个应用，运行起来还很顺畅，这个真可以，发热在接受范围，拍照效果也不错，好评！！！！！！,5
物流非常快，服务也很好，直接送到家门口。机子性能很棒，特别是打游戏，功能非常齐全，还赠送正品快充，我很满意这次购物，京东值得信赖！,5
外观整体很满意，手感很不错，比较轻盈，没有沉甸甸的感觉。音效不错，照片清晰，运行速度块。使用一段时间后会再来追评，相信大厂品质！,5
1、iQOO Z3这款手机的性能是非常不错的。它采用了高通骁龙768G处理器+LPDDR4X+UFS 2.2的性能组合，安兔兔跑分成绩高达453527分，基本上是能够满足大多数人的日常需求的。2、iQOO Z3这款手机的屏幕质量非常出众。iQOO Z3的采用的是一块6.58英寸的LCD直屏设计，想要强调的是这块屏幕支持120Hz刷新率和180Hz触控采样率。3、iQOO Z3这款手机保留了独立的耳机接口。4、iQOO Z3这款手机的续航能力不错。这款手机的电池容量为4400毫安，支持55W的快速充电能力。5、iQOO Z3这款手机的散热效果非常不错。iQOO Z3的散热系统包括液冷热管、多层石墨散热片、导热铜箔、导热凝胶和6颗温度传感器（感应热源动态调动硬件资源）。这种散热用料，在千元手机中是非常少见的。,5
这款手机双十一购买的，用了一段时间才来评价，双十一活动价及各种优惠券叠加只花了1899外形外观：个人觉得外观漂亮，手感也很好，侧边有指纹识别速度很快拍照效果：拍照效果很清晰，效果很好运行速度：8G十128的速度就是快屏幕音效：屏幕流畅，速度快，其他特色：这款手机电池大，一般没怎么用二天冲一次电,5
这款手机性价比超高啊，运行速速度也很快，用了一段时间才真心觉得好,5
好用，速度快，外观漂亮，cpu处理超级快，内存很大，可以无限极下载软件，值得购买，正品跟专卖店一样好,5
外形外观：大方得体，好看，沉稳，干练屏幕音效：音效质量没的说，杠杠滴拍照效果：拍照像素高，很好。运行速度：快，准，很稳。待机时间：够用，管够 哈哈其他特色：这款手机很好用，很有内涵。,5
使用了几天感觉不错，手机挺大，做工很好，手感好，多开软件速度方面没问题，对不玩大游戏的人来说很合适。,5
这款手机性价比很高，搭载骁龙768g处理器，还有高刷屏，闪充和4400毫安续航电池，照相方面也还不错，手感轻薄，千元价位，很值。,5
手机性价比非常高，质量好 大屏上档次，细节做的也好，自带钢化膜和硅胶后壳，拍照自带美颜，家人都很喜欢，玩游戏也流畅，值得入手。,5
手机已收到非常不错一款手机，功能多操作顺流、图象清楚音响很好，运行快打游不卡了充电快，打大型游不用担心卡机了、照相功能是三摄像头，照相很清楚反正是一款很好用手机。,5
手机包装很有大厂风范，手机屏幕惊艳，很流畅！第一次让我觉得国产手机可以做到世界及水平！手机摄像很清晰给老人用足够了！这个配置够他们玩@了！晓龙的处理器没得说，信号好！vivo手机音质也没得说，毕竟是音乐手机世家！京东物流是真的快,5
从一步步打开包装，就很期待，也很神秘。这款机子在我购物车里关注了很久，今天终于买了，兴奋，爱了爱了！尤其是拍照效果很棒，内存也足够大（工作和生活可以随意拍了）。总之，非常满意，物有所值。推荐一下,5
外形外观：外观一眼就吸引眼球，外形也很突出，看上去很有视觉感，非常满意，非常吸引！屏幕音效：屏幕视觉效果也不错喔，非常满意，也是很给力，游戏，视频不在话下！拍照效果：三个摄像头，远近，微距，都是给力，效果也棒棒哒！运行速度：目前的运行速度还是不错！待机时间：看评论待机时间短，这是事实现象喔！,5
惊艳，拿到手机的第一感觉。幻银，色彩多变。手感超级棒，售前售后客服态度热情周到专业，回复超级快。京东自营店，京东物流样样都是那么的省心省力。物超所值，值得推荐购买的一款好商品。,5
运行速度：用起来很不错的，拍照很不错的很清晰，比小米拍照清楚很多，比较满意的一次购物，就是到货有点长是真的，但还是比较满意的,5
对于不玩游戏的人来说性价比很高的一款手机 当然这手机应对一般的游戏也是无压力 买给老爸用的 自己用的是iqoo855 感觉质量不错 老婆买了一个z3 之后又给老爸买了一个z3 8+128给他们用无压力 比红米强多了 值得推荐,5
vivo IQOO Z1感觉很实惠，天玑1000+的处理器非常强大，144HZ顺滑到底，打游戏还有monster模式，很给力，4500毫安电量基本上可以用两天。安兔兔跑分523852，真的牛，网络连接也挺快的。尺寸大，唯一遗憾就是不送耳机，不过这个价位已经很实惠了。,5
视听方面，iQOO Z3配备了一块120Hz高刷竞速屏，适配多达14款高帧率游戏，能够带来出色的屏幕体验。配合上180Hz触控采样率、鹰眼显示增强2.0、游戏护眼2.0、4D游戏振感等功能，iQOO Z3的手机游戏操控体验也全面升级，真实感大大提升。影像方面，iQOO Z3配备6400万超清全场景三摄，具体包括一颗6400万像素主摄、一个120&deg;超广角镜头、以及一颗超微距镜头。iQOO Z3支持老照片修复和上色、超广角夜景和超级夜景自拍2.0等众多拍照功能。其中全新超级夜景2.0能够显著提升手机的夜景捕捉能力，无论日夜场景皆能拍出高质量的照片，大大提升和丰富用户的拍照体验。,5
很好用的机器，没想到1000多块钱的机器也这么好用充电很快，待机时间也很长，早上充满之后到晚上都有电，而且游戏体验也很好，不错的机器,5
外形外观：云氧拿到手比图片还好看一点，折射出紫色流光，炫目。存储：8+128的，8G运存开很多软件都不会卡，切换十分丝滑。我平时只拍照听歌不下电影，内存完全够用，就不必花额外的存储钱了！其他特色：充电真的非常快！玩到没电，接上电源没一会就到50%了，以后出门充一会就好不用担心！运行速度：玩了王者荣耀和吃鸡，可能是刷新率很高的原因，所以不论感觉比以前玩起来场景画面要顺滑一点，非常好?散热：很惊艳 2个小时游戏 这台手机一点不烫手整体很满意，拍照没怎么用，后面再追评,5
京东自营店发货速度很快   物流隔日达   多次在自营店购买手机  质量还是有保障的    这款手机性价比不错  运行游戏无压力   拍照也还可以   值得购买,5
外形外观：比想象的好太多了屏幕音效：声音很好拍照效果：效果真棒运行速度：很爽啊待机时间：可以其他特色：手机是相当的不错了颜值这一块,5
拍照效果:像素很清晰，通信音质:音质清晰，充电速度，非常快，55W充电不到一个小时就满血复活了。运行速度:非常快，没有卡顿。赠品也很给力:iqoo原装耳机＋原装充电器套装。非常实用。完全不用担心充电器丢失因素了。这是在京东商城买的第二个vivo手机了，兄弟和我每人一个，第一台手机用了差不多四年，还很好用，一直喜欢vivo手机，支持国产。物流很快，头天晚上下单，第二天白天上午就送到了，支持京东，祝京东商城越办越好。,5
一拿到立马****，手机电池比以前的手机耐用，非常喜欢这个操作模式。,5
说好准点下单就送双肩包，结果是忽悠我们买手机，非常失望。,5
还行，没有测评说的那么差，内存256gb ，这次不会满了吧。哈哈哈。玩吃鸡挺流畅，发哥这次真的很不错。,5
外形外观：外观好看，摸起来很舒服，看着很满意屏幕音效：屏幕非常清晰，也不刺眼，看着很舒服拍照效果：拍照挺清晰的，个人觉得还不错运行速度：运行状态不错，打游戏不存在卡顿现象,5
第一次买vivo的手机 收到货后真的挺惊喜的，首先 包装非常精美，手机盒子非常特别，充电器很大个，而且充电速度真心是快，手机手感也非常好，不卡顿 顺畅。性价比很高,5
手机很不错，媳妇手机老卡了，买来送给媳妇的。媳妇很喜欢。,5
外形外观：外观本人很喜欢，颜值超高屏幕音效：屏幕分辨率很高，显示效果很好拍照效果：拍照很清晰，超级无敌喜欢拍的照片运行速度：速度很棒运行速度基本满足日常工作需求待机时间：待机时间很不错充好电玩了,5
手机收到了，用了一段时间才来评价的，拍照效果特别清晰，电池玩游戏也耐用，通话音质清晰，相当满意的一款手机，谢谢。,5
京东快递一天就到了很满意，手机待机时间长，拍照清晰，色彩饱和度不错，重量挺合适我的，分辨率高，充电器都特别大，很沉，感觉里面是铜芯的线圈，做工也很好，用一段时间再来，因为经常跑工地，得拍照，像素很清晰。6＋128也足够大了，互传了旧机的资料，灰常方便。,5
iQOO Z3在手机内提供了高帧率游戏专区功能，支持多款主流90/120帧的高帧游戏，贴心设置高帧率专区，入口便捷，可以更加方便、快捷地查找和下载高帧率游戏，从而解决手机拥有空有一款高刷新率屏幕但是却缺乏高帧游戏资源的问题。在120Hz电竞屏的加持下，不管是高帧率玩和平精英、王者荣耀游戏，还是量子特工、巅峰坦克，游戏操作更加稳定顺滑，画面观感也更加细腻广阔，尽管享受游戏带来的沉浸快感。,5
手机收到好几天了用着挺好的，反应挺快的内存也够大，屏幕也清晰声音清楚比较满意的一款手机，发货也特别快，第二天就到货了！送了手机外壳，很满意，,5
手机特意收到是用了才来评价 速度很快 年轻人玩游戏的利器 大家可以冲！手感好不发热 待机时间长 像素也可以 价格合理  冲,5
外形外观：外观非常漂亮，特别是背面的颜色特别好看屏幕音效：没有送耳机，外放效果不错拍照效果：拍照效果还不错，夜景模式非常强大运行速度：打王者荣耀非常流畅待机时间：一天轻度使用基本能剩60多，非常耐用,5
12+256大容量，这个价钱，真是赚到了。系统很好用。客服服务态度很好。物流很快。日常生活必需品，买这款手机没错。颜色很有特点。一点没毛病。值得入手。,5
手机很喜欢，颜值控的我对这个配**有独钟。拿在手里感觉海阔天空。手机性能对个人而言那是任意驰骋，操作运行流畅。拍照效果色彩还原真实。,5
手机非常不错，还送了一个耳机外形外观是颜色漂亮的拍照，效果也好，看朋友推荐的都是用来做啊，朋友最喜欢的奥迪Vivo手机。他一直都用Vivo手机，他觉得Vivo手机最好用，然后他也让我买这个手机，然后我买了。结果真的还不错啊。,5
手机手感很好，颜色正是我想要的款式，拍照和音质都很好，运行也很快不卡顿很流畅，性价比很高，店家还送了耳机，京东的配送也太快了，晚上快12点的时候拍的，第二天上午就到了，包装完好无损,5
"手机外观漂亮，性价比高，手感好，音效不错，声音大，低音很正。屏幕够大屏占比达到了90%，具备98%的色域显示，显示效果很好，支持144HZ刷新率，反应快，色彩艳丽。联发科最新处理器给力，手机运行速度快，电池容量大，充电迅速，内存256G ,赞，足够用了。",5
宝贝收到，京东购物方便，物流快包装好，价格合理，手机质量不错，外观设计漂亮，上手舒适大方，系统运行速度快，功能全面，千元机的首选，很好满意，好评。,5
手机已经使用，有一段时间了，总体来说使用体验还不错。首先，外观中规中矩，前置挖孔摄像，侧边指纹识别，144Hz屏幕刷新率，4500毫安大电池加44瓦超级快充，后置4800万三摄，立体双扬声器，联发科天玑1000+中央处理器，8+128g大内存，最新系统使用起来有飞的感觉，还有这次的活动优惠比较大，这个价格买到非常超值，推荐大家去购买。,5
运行速度：联发科1000还是很快了，还满意外形外观：颜色好看屏幕音效：屏幕还不错拍照效果：试了微距还很不错待机时间：我正常用撑一天没问题，电池充电确实快,5
手机采用的是55瓦的高速快充，充电速度非常的快，而且手机电池非常耐用，做工非常的精美，果然是背靠蓝厂的生产线，出品率杠杠的，而且价格也不贵，非常值得给父母购买，拍照也十分清晰，使用很简单，手机系统非常的人性化,5
前天晚上下的单第二天早上就到了，手机很棒主要喜欢iQOO的系统，打原神极高画质可以流畅运行，但是压不住温度?，系统很流畅也没发现bug一类的还有很多人性化的设计。i了i了?,5
屏幕亮度不够，太阳底下啥也看不清。烂橘子系统动画改进的很不错了 但是系统有些操作逻辑还是有点反人类，小窗模式不能说很难用只能说一般，没miui的小窗好用（如图）做成这样不更方便吗，难以理解能做好为什么就是不做，自己搞了个mi窗用着舒服了不是一点半点,5
帮朋友买的，他说用起来很不错，像素很高，样子也很漂亮，快递也非常给力，很喜欢，很满意！跟描述的是一样的，很显高档，物美价廉，要买的朋友可以下单噢！,5
用了一段时间来评价的，使用感还是很满意的。外观也很时尚，分辨率很高，玩游戏一点也不卡很流畅。用起来很爽，内存终于不会不足了,5
外形外观：这个颜色非常靓屏幕音效：还不错拍照效果：挺好运行速度：运行很快 很给力待机时间：待机时间长其他特色：比较窄适合女生握持,5
这个IQOO的z3手机怎么说呢，的确是国产之光，游戏支持的性能很好，品质也非常的棒，特别适合我们这种游戏手残党，适合使用，我特别的喜欢,5
物流太给力了，手机盒太酷了，用起来手感也特别好，天机1000+真的一点都不卡，像素特别好，手机屏幕分辨率也特别好，最重要的是充电速度太快了，我太喜欢咯，续航能力超级强。???,5
这颜色太惊艳了，一千五里面性能比较强悍的，快充也很给力，手机流畅度也很好，拍照很清晰，晚上拍照没什么噪点，性价比很高，打游戏开最高特效也很流畅，高刷屏还是很不错的，很跟手。,5
给朋友买的手机已经用上了，运行速度非常快，续航的话一天冲一次完全就足够了，没有续航焦虑，拍照效果也很满意，显示效果也很清晰，还送了有一个无线耳机。,5
物流超级超级快！质量也非常不错，的确物有所值，最主要手机性价比很高，外形外观：特别漂亮！屏幕音效：声音大，屏幕大拍照效果：超级清晰运行速度：玩游戏一点不卡，特别流畅待机时间：充电快，待机时间长,5
颜色很喜欢，手机拿着也顺手，挺舒服，音效很好，声音也挺大，运行速度很快，待机时间长，充电速度快！,5
"外观上小挖孔屏幕，侧边指纹识别速度非常快，外观颜色也很好看。屏幕还行，视觉效果不错,带有智能调节刷新率功能，总体上还算很棒的。",5
外形外观：外观颜色耐看 手摸上去质感不错屏幕音效：双扬声器效果就是好 144赫兹的屏幕 很让人惊艳，看上去很舒服 就是整个机子感觉厚了点。 自带软件有点多 其他都很完美。 待机时间：没玩什么游戏。用两天没问题 运行速度：速度很快呀。这个CPU很好。之前还担心来着,5
购买的第三台vivo手机了，很漂亮的天空蓝，手感舒服，系统运行很流畅，待机时间长，非常满意。,5
买的时候挺期待的，好在京东快递挺快的，今天买，第二天就拿到了，内心的期待得到了极大的满足，快递员服务态度也很好。手机外观颜值挺在线的，屏幕显示效果清晰，打游戏也挺流畅的，吃鸡王者都不在话下，稳稳的，充电也挺快的，充一会就能用好久。这个价格能买到这么好的手机，很可以了,5
趁着一年一度的618活动，比较了一下几个品牌的手机，最后买了这款手机，京东快递真的很快，第二天就到了，手机拿到手马上用起来，用起来还不错，反应都挺快的，掉电有点快，不过充电也是非常快的，别的等用段时间再作评价。,5
性价比很高的一款手机。通话质量好，屏幕色准高、效果细腻，高刷屏感觉很丝滑。帮老妈选的，很满意。,5
盒子很有科技感，还送了手机壳，手机很流畅，系统也很漂亮。拍照还不错，内存很大。外形外观：外观很漂亮，背壳反光很好看屏幕音效：外放听歌还不错。,5
外形外观：很好看，超喜欢屏幕音效：声音很大拍照效果：挺不错，很清晰运行速度：很快，不卡待机时间：充电速度超级快，一会就充满了,5
给老妈买的手机，样式很不错，屏幕也大气，音效也很好，拍照方面很清晰，像素很高，拍出来的照片很好看，用了个把月了运行速度方面也不错，希望质量过关可以用的久一点?,5
手机非常好，性价比很高，外观做的很精致，太喜欢了，续航也很好，游戏体验超棒，电池续航能力强，两天没有问题,5
刚打开手机快递包装外形外观简约大方，屏幕音效还可以，拍照还未使用，运营速度很快，先给五星好评！使用一段时间之后再来追评，,5
这款手机颜值挺高的，系统也用的顺手，性价比也不错，vivo手机做工一直不错，加上55W快充，充电速度超级快，玩游戏也给力，很满意！,5
手机很好用，买了好几个vivo了，一家人都用这个牌子，充电特别快，手机优化的也比较好，不卡，价格在同等机型里面也算便宜，大品牌值得信赖，就是不是plus会员，所以没有耳机，哈哈，不过也还不错？,5
物流很好，第二天就到了，挺好用的机子，拍照也清晰，用的顺手,5
"打个视频电话就很烫,而且前置可以自己调参数,可谓榜首!充电极快,还有直播间送了一个运动包,打王者不要太好,整点送了个无线蓝牙运动耳机,运行速度:操作很流畅丝滑已经被老公黑了,以前买的 iqooneo 这是第二部同款手机了,昨天发货今天上午就到了",5
"才一千多,拍照像素也高,性价比超高的一款手机,捡到宝了?!!!非常好。还送了耳机音质很好,打游戏一点也不卡,喜欢拍照和打游戏的赶紧入手!!!15秒",5
手机已经收到货了，外包装高端大气上档次，非常美观。手机也开机用了，速度很快，内存很足，储存量也够大。手机的颜值也非常好，趁着有活动入手的，价格也很满意。,5
说一下用机体会，首先机器设计的非常漂亮，选择的颜色也非常的淡雅清新，运行速度嗖嗖快，拍照清楚还可以自带美颜，对于喜欢拍照的我们家来说非常适合，手感比较轻薄，但是一定要带上手机壳，不然太丝滑害怕滑手，屏幕比较大，但是宽度设计的正好单手可以握住，挺好，总而言之非常满意。,5
手机很快就收到了，充电很快，续航能力还蛮好的。星云的手机壳也好看。新手机，上网速度不错。手感大小合适。总之，非常满意。京东快递也挺给力的。,5
使用VIVO的手机有好多年了。使用习惯了，换了新的手机就是快，充电也很快，正常使用电池可以使用两天，重点是性价比高。打开应用再也不需要等半天了，还可以固定小程序，非常方便。使用了一周，速度是没得说，打开速度特别快，一周充了三次电。充电也很快。现在的充电口也使用了TYPE C接口，充电就是快。前几次充电还是充满后再多充一下，会更耐用。,5
买回来给家人用的，试用了几天很不错，流畅稳定，骁龙768g日常够用比起888省电多了，试着玩了一把王者全程60不掉帧，室温25手机温热。很好这价格值了。,5
天机1000+性能强悍，12g运行内存完美。机器很轻薄非常好看，nice。性价比神机！快递也一如既往给力，上午下单下午到！,5
十分不错的手机，真的很棒，用起来手感很不错颜值高，家人很喜欢。这是z3很不错的设计，无论是运行速度还是电池都能满足需求。很棒，还会推荐的,5
手机手感，外观都是大爱，性能也不错，非常喜欢，拍照效果：具体的细节拍摄还没有试验过，像素成像方面还是很强大的,5
手机不错，系统很好用，用起来很舒服，画面流畅，运行很快，打游戏很流畅，性价比很高,5
马上就是父亲节了，父母的手机用了两三年确实有点卡了，趁着618活动给他们换新机。???   骁龙768，8+128，120赫兹刷新，老人足够用的！???   拍照效果，老人也非常满意！！???  OriginOS系统我自己也在用，真的很流畅！！???  京东物流依旧给力！！???,5
这个银色的是真的好看，手机外形很满意，而且外观不错，屏幕很清楚，音质音效都不错，拍照效果也好，运行的很流畅，不怎么卡，打游戏也可以,5
这款机器，怎么说呢，游戏支持的性能非常的好，机器的流行型设计，真的是国产之光，用心做好机，踏踏实实的热爱国产，爱国，更努力，不错的,5
