评论,评分
刚刚好，中秋前到，给家里的老人换手机了???吃饭的时候拿出来分给他们，还被老妈吐槽怎么都是同款同颜色。我说这是今年我们家的特色?????以后找手机要靠手机壳了???????不错他们都很喜欢，完美,5
好愉快的一次购物体验,5
"嘻嘻！想不到手机拿到手上后的感觉就是不一样，坠坠的，有点沉；处理器够用，购手机送55W快充，入耳式耳机很nice,真是太开心了，很值得购买！真是太有魅力了，拿在手上有丝滑的感觉，系统流畅，档次高，值得拥有！",5
好用 价格实惠性价比高,5
第一次用vivo手机，感觉还是很不错的，外形时尚，配置给力，像素也可以，包装完整，物流神速，五星好评！,5
用了几个月了，说下感受吧，充电很快，四五十分钟就充满了！像素一般，信号不好，很不好，电信卡也有，联通卡也有，和别人坐在一起，别人的手机可以打王者，这个刷抖音都卡?，维沃手机性价比还行，第一次用，也是最后一次用！,5
已经收到货几天了   很好用   也很快   运行也很好   内存大   好用好用   你值得拥有,5
给孩子买的！外形外观：孩子喜欢！屏幕音效：很时尚！音效不错！拍照效果：还好吧！运行速度：非常快！待机时间：基本上一天一充！还可以的！,5
外形外观：没问题，外观很好看屏幕音效：音效很棒拍照效果：拍照清楚，画质很不错运行速度：运行速度快，开60帧率也可以待机时间：我不玩游戏，不重度使用基本一天充一次其他特色：客服服务态度还不错，,5
特别特别棒，货比三家才买的，店主人很好，回答问题很有耐心，也很详细，有需要还会再来的物超所值，非常满意，期间有点小插曲，店家细致周到的服务让人很感动，祝生意兴隆，还会再来很精致，质量非常好，很满意的一次购物。谢谢店家！值得购买的产品，做工非常精细，比想象中的好，推荐大家尝试宝贝心仪很久了，趁活动时候买真的太划算了，喜欢的不要犹豫啊,5
这手机续航真的不错，如果不打电话，也不看视频，可以待机好几天。因为我用做备机的，拍照也比我原来的x21好多了。信号方面可能是环境方面因素吧，有时候三格有时候满格。开启5G速度真的快，就是流量用的太快了。,5
外形外观：非常炫酷拍照效果：试了一下非常清晰做活动的时候价格很划算，入手不后悔,5
外观设计漂亮，星云高档绚丽，像一道彩虹美丽无限，竞速屏图像柔和清晰，8+256g流畅不卡顿，非常满意，尺寸大小合适，包装仔细完整，宝贝手感也不错，感觉很好，发货速度快，服务态度一流，给力！5星好评！,5
好评，这次发货速度较之前慢了一天，手机还不错，外观好看，拍照效果好，妈妈很喜欢，换了新手机壳格外好看,5
"1、手机已经收到了，收到已经使用了两天，大厂生产的商品就是不一样，之前一直用vi12,买这个手机其实是冲着这个系统来的，用起来确实很新颖，用烦了苹,手机已经到手好几天了，个人觉得外形美观，音效非常完美",5
正品店铺，放心购买，客服态度也很OK，整个购物过程非常顺利！下次还会再来的！赞！商品符合描述，主要是活动便宜，能省很多钱，充电简直非一般的感觉客服服务态度很好，快递也不赖，希望老板生意越来越好！！！,5
颜值很高，系统感觉比OPPO的好更丝滑一些，拍照很不错，给老人买来用但是自身没有简易系统，需要去商店下载官方简易版本，也不麻烦，但是颜值照OPPO的简易系统差了好多，优点是也确实是方便老年人，总体很满意，后续观察续航能力如何，最后赠送的背包很好看，哈哈,5
手机不错。外形外观：闪屏幕音效：凑拍照效果：清运行速度：快待机时间：行其他特色：中,5
怀着满怀期待的心情买了，现在一家人都用上了爱哭。非常不错外形外观：大气父母也非常喜欢屏幕音效：千元机里面全是不错的。拍照效果：拍照非常好。运行速度：父母够用了。待机时间：中年人一般一两天。,5
765的处理器，性能与性价比并存商品质量不错，细节、品质、做工都非常好，发货超快，镇里第二天就到家，用起来很放心，自营的物流让人非常惊喜。新的系统非常流畅，续航基一天半是够用的，充电非常快，真能做到15分钟充满60%的电量,5
"外形外观：个人喜欢蓝色，果断挑选太空蓝，手机摸着不是很沉，用着很舒服。屏幕音30,手机已经到手好几天了，个人觉得外形美观，音效非常完美，特别是,外观设计漂亮，星云高档绚丽，像一道彩虹美丽无限",5
这款手机性价比很高，我是用来拍照的，特别清晰，拍照效果很好。大小很合适，日常用没问题。这个是真的好，材料和做工都特别精致，做工真的非常棒，我觉着我可以推荐给我朋友买，性格也很强，打游戏没问题。,5
外形外观：手机挺好看的，银色还带有别的颜色的炫光屏幕音效：lcd永不为奴，精细度很不错，没有屏闪拍照效果：拍照效果也挺好的运行速度：速度挺好的，高通的比联发科的就是稳定待机时间：待机时间也挺长的,5
这手机性价比没的说，可以说这个价位这个品质这个配置，没有谁了，值得拥有,5
跟描述的是一样的，很显高档，物美价廉，要买的朋友可以下单噢！已经用过一段时间了，效果不错?，客服服务有耐心，解答详细，赞一个特别特别满意，超级好看，客服很有礼貌，很客气，良心商家，支持！正品，棒棒哒，价格很优惠，总而言之挺好的，还会再买物流超级超级快！质量也非常不错，的确物有所值物流超级超级快！质量也非常不错，的确物有所值,5
星云配色带来的视觉观感正如其名，在光照下转动机身时，可以看到后盖表面浮现的彩虹光影，整机显得特别精美该机所内置的6400万像素的后置超清主摄以及超级夜景2.0算法，确实赋予了它更出色的影像性能,5
电话机性能越来越好  ， 工艺也越来越好   就是机械尺寸越来越差   外观越来越***臭    尤其是屏比   ***不晓得是哪个龟儿子这样设计的    以前 16 比9   多好的    双眼观感比例很协调     还有背板非要整成弧形   这种设计是不是屎吃多了,5
买了两台IQOOz3了，性价比不错，买了给老人用的，正在调试，希望京东自营买的和专卖店一样,5
发货很快，第一次用vivo手机，感觉系统很流畅，体验也很不错，充电器也有55w，充电很快，不错,5
手机已经到手好几天了，个人觉得外形美观，音效非常完美，特别是戴上耳机更佳，运行速度很好，拍照比较一般，毕竟是主打游戏，体验非常棒，待机还行，正常使用能用很久，打游戏耗电快，发烫，都属于正常现象,5
外形外观:包装高庄大气上档次，低调奢华有内涵。手机外观也非常好看。屏幕音效:屏幕大，显示效果好，声音洪亮，非常满意拍照效果:拍照效果棒!满足日常拍摄需求运行速度:各个应用程序切换流畅!,5
外形外观:包装高庄大气上档次，低调奢华有内涵。手机外观也非常好看。屏幕音效:屏幕大，显示效果好，声音洪亮，非常满意拍照效果:拍照效果棒!满足日常拍摄需求运行速度:各个应用程序切换流畅!,5
外形外观：包装高庄大气上档次，低调奢华有内涵。手机外观也非常好看。屏幕音效：屏幕大，显示效果好，声音洪亮，非常满意拍照效果：拍照效果棒！满足日常拍摄需求运行速度：各个应用程序切换流畅！,5
手机收到了，非常好，像素试过了很清晰，这款颜色也非常好，很漂亮，运行速度也很棒，很满意,5
首先是外观和握持的体验，说实话刚拿到Neo5的第一瞬间我甚至以为这是iQOO 7，细腻的高透AG磨砂玻璃配合双曲的弧面玻璃，握在手里非常舒服。后置镜头模组也逐渐形成了vivo家族独特的&ldquo;云阶&rdquo;设计，辨识度不俗。正面搭载了一块6.62英寸的高素质OLED屏幕，支持120Hz的刷新率和HDR10+显示效果，也通过了SGS的护眼认证和低拖影认证。在实际体验中，显示画面足够细腻，看久了也不会累。不过阳光下个别情况下不会激发峰值亮度，期待后期OTA,5
从没想过这么实惠的价格能买到这么好的宝贝，下次还来你家商品符合描述，主要是活动便宜，能省很多钱很快就到了，全新正品?，包装很仔细，没有问题用了觉得很不错，商品质量好，发货也挺快的，总之就是很赞了本来还很担心东西不好，拿到手发现完全多虑了，五星好评,5
当时购买了真我Q3.退了！马上下单购IQOOZ3，充电非常给力！拍照清晰！物价廉美！,5
用了一个多月了，挺好用的,5
vivo的老用户了。z1，z5，iqooU3，这个iQOOz3四个手机，使用都挺不错的，性价比高，这个z3充电确实快，运行速度也挺快的。这次购买店家还送了双肩包和无线运动耳机，非常给力。,5
手机已收到，颜值很好看，性能好，京东物流非常快客服服务好，性价比较高，值得购买。,5
外形外观：外观很漂亮，手感很好，拿着用着很舒服屏幕音效：屏幕大音量大音质好拍照效果：拍照清晰，美颜好用运行速度：运行速度快，指纹解锁快待机时间：待机时间长电池电量大，续航时间长,5
京东物流就是快，昨天下午拍的，今天上午就到了，再评价一下手机，外观挺好看，比iqoopro略微长一点，上手感觉很轻，运行速度很快，其他的还在摸索熟悉中，作为千元机来说，性价比不错，喜欢的可以考虑入手。,5
手机已经收到！前天买的自营产品，一直信赖京东自营，信任京东物流，竟然没想到出现这么大的人为失误，要求官方严查原因，并给出合理解释！本应该昨天到的，结果发错地址了，今天才收到，耽误了使用等待后续处理结果！,5
"京东物流就是快，昨天下午拍的，今天上午就到了，再评价一下手机，外观挺好看，比iqoopro略微长- -点，上手感觉很轻,运行速度很快,其他的还在摸索熟悉中，作为千元机来说，性价比不错，喜欢的可以考虑入手。",5
此用户未填写评价内容,5
送货速度超快，这是京东可以称赞的地方。vivo的机子散热有点慢，玩久了会很容易就发热。但目前耗电量还可以，最怕发热快的机子耗电又快。星云这个颜色很好看，好闪啊。京东会员买这个机子多送了一点充电器，挺好的。,5
这款手机给妈妈用很合适，性能过得去，聊下~，刷下~蛮好的，拍照也比较清晰。768芯片足够长辈使用，屏幕显示细腻，响应速度快。只是安卓11的底层长辈需要熟悉一阵子了，还有一点就是预装软件较多，不够简洁。,5
还阔以，蛮好看的，就是这个好炫彩啊，我看着怎么不像银白，有点紫调喔，有点，镭射啊,5
外形漂亮  千元左右性价比很高  运行流畅屏幕清晰值得拥有,5
手感不错，是想要的感觉。用着也挺好，速度挺快，很满意。,5
手机老早就收到货了，见图，通过这么多天的使用，感觉还不错，系统流畅，个人满意。,5
今天收到货，迫不及待的打开了，很喜欢，手机很精致，非常喜欢，拍照效果很不错，很清晰，充电也很快，性能也好，买的非常满意，听音乐，音质也非常棒，性价比之王，没点缺点了，喜欢的朋友非常不错的一款值得购买.,5
昨晚下的单 今天就到了 京东快递真的挺快的  手机整体感觉非常奈斯。手机外观和功能 都没问题 其他也都ok 像素有试过非常ok 只能说nb哈哈 其他的 等用一段时间后再来评吧！,5
这手机 真的挺好的 性能也挺不错的 用了几天 真的挺奈斯。 拍照也挺清晰的。可以。 玩游戏更不在话下。那些王者  吃鸡 或者其他的游戏 都能玩。真的可以。有需要买性比价的机子的话 买这部。真的挺奈斯的。不错。,5
此用户未填写评价内容,5
用了二个月了，总体感觉不错，时钟设计是我喜欢的，健身时用这个时钟很方便，日历也很方便，相机的证件照功能也是太方便了，缺点还没发现,5
收到。宝贝真心不错，性价比很高，经济实惠。快递的速度也是给力，收到之后打开看，各种东西放的非常文全包装完整，数量多分类搭配好。现在的东西多的让你眼花缭乱，你家的货我会一直买下去的，给你五星好评!!!包装的确不错，特别是外观，觉得挺好看，挺有个性的!质量真心不错，价格也真心实惠!五星好评，无限回购，没毛病!,5
现在的软件占用空间真的是越来越大，没法只想选个256的。之前用的小米8，用了2年视力下降的厉害，还是不适合用OLED的屏。放下还用LCD的基本都是中低端了?。还好年龄大了，不打游戏了，硬件性能凑合就行了。一开始买的摩托罗拉的一款，870处理器的。结果跟个板砖似的。果断退货了。上手一周，总体这个价格，适合我的需要。,5
给老妈买的，视频了一下，效果特别的好，不亏是千元机中性价比高端机，送了耳机，充电线，一样还走一个快递，也是没谁了，牛批牛批。没得说，口碑在那块放着呢！配置，给力，一般需求杠杠的。,5
vivo Z3 12+256手机性能不错外形外观：外观较简单，屏幕音效：屏幕尺寸大，适合看电影，音效也很不错拍照效果：拍照清晰运行速度：运行流畅待机时间：待机时间超长,5
包装完好，物流很快，运行速度：运行速度：， 快，手机拿着有手感，很喜欢,5
6400万像素，55W快充，水滴屏，而且还是3.5mm耳机孔，电池容量大，续航时间长，充电速度又快。还支持安装存储卡。这个价，太值了。好评！京东物流，yyds，昨天买今天到！,5
6400万像素，55W快充，水滴屏，而且还是3.5mm耳机孔，电池容量大，续航时间长，充电速度又快。还支持安装存储卡。这个价，太值了。好评！京东物流，yyds，昨天买今天到！,5
手机收到了，用了一下，运行速度还算蛮快的，拍照效果好，声音也大声，比较喜欢的,5
手机非常好看 性能测试很棒。这款性价比很高值得推荐,5
新手机终于到了，我赶紧拆开看看，手机外观大气，曲面屏很漂亮，手机手感不错，拿着很舒服，拍了几张照片，很清晰，运行速度快，打游戏不卡顿，这个价位买到性价比这么高的手机真是不错。,5
手机外观很漂亮，配件很齐全，系统很流畅，给家人买的很喜欢,5
第一次用这个牌子的，收到很喜欢，外观设计大气，触屏快手感不错，支持国产,5
手机很不错，物流也很快，这是买的vivo第四部手机了。,5
买这个手机其实是冲着这个系统来的，用起来确实很新颖，用烦了苹果和安卓原生的，真的可以来试一试这个系统，清新有趣。再加上55W的快充，真的很快，用了就离不开了，基本上可以告别充电宝了。游戏模式功能丰富，120Hz的屏幕确实流畅很多，有些丝滑的感觉，处理器够用，再加上首发送的一套快充和耳机，简直完美！！！,5
京东自营的，送货快，手机运行速度快。流畅杠杠的。不错,5
?宝贝质量很好，收到货第一时间打开看了，很不错?，很满意?，客服也有问必答，感谢?终于收到货了，非常非常喜欢，做工精致漂亮，已经被很多人夸了，真的太开心了，已经是他家的忠实粉丝了，以后还会继续买买买的外观干净漂亮，做工很不错，没发现什么瑕疵，个人感觉大小也挺合适，找了很久选的这款，大爱！,5
还行吧，用着很丝滑，不错外形外观：好看，水滴屏,5
iqoo大牌子，作为性价比品牌，出的手机性价比都很高，对于我们学生党非常合适，包括拍照，屏幕声音等方面都很好，打王者一点都不卡，网速很快，充电速度也超快，非常喜欢这款手机,5
外形外观：外观真的很不错了，很棒的一款手机了，用起来真的是超级好用喔，真的很棒哟屏幕音效：屏幕效果也是真的很好了，拍照效果：拍照效果也挺好的，真的好棒运行速度：还是可以,5
商品收到咯，特别喜欢，一收到就迫不及待地打开了，家人也很满意，这次购物体验不错快递很快，质量棒极了，建议购买物流满分?，包装快递满分?，配送员态度满分?，购物让人开心，吃土使我快乐~?????????,5
反应快，实惠，好用，像素清晰，值得购买，好用，！,5
又一次的买到了iqoo的新款手机 ?哦 还不错哦哦 对于iqoo有了很多喜爱 价格是主要原因 充电很快 拍照不错 运存很大 还送耳机 虽然不怎么样 送老人很欧嘞,5
第一次买vivo手机，系统还不太用习惯，感觉挺好的,5
整体不错，运行流畅，拍照清晰，手感不错，待机不错，音质不错，充电很快。,5
很好，给孩子买的，运行速度很快，origin os 界面很美观，用起来也很方便，快捷键也比较人性化，分辨率很高，清晰，充电速度很快，55W的充电器速度飞快！赞?,5
外形外观：外观基本公共模具，想要辨识度基本没有屏幕音效：lcd的屏幕越来越少了，显示效果只能说及格拍照效果：老人使用日常使用运行速度：买的大内存，希望坚持3年就好,5
外形外观：这个手机外形长得很好屏幕音效：屏幕音效也很好拍照效果：拍照很清晰运行速度：运行速度很快待机时间：可以很长时间待机其他特色：很实惠，这个手机性价比很高,5
?值得购买！没有什么味道，用起来还可以?，没有不舒服的地方?，所以我还蛮喜欢的货收到后就拆开用了，质量很好，东西和官网买的没区别！包装很完美，颜值很高，感觉物超所值！客服也非常耐心细致，发货快物流给力，以后还会再来??,5
昨天下单今天就到了这速度杠杠的，手机外观好看是我想象中的样子?，手感好触屏灵敏?，等用过一段时间再来??外形外观：好看很喜欢?屏幕音效：???拍照效果：???,5
外形外观：外观真的很不错了，用起来是很流畅的。真的很棒的一款手机了，哈哈，用起来真的超级不错了喔屏幕音效：屏幕效果也是很好的，很不错了喔，很喜欢拍照效果：拍照也还行,5
外形外观：外观挺好看的，简约时尚。拍照效果：拍照特别好，清晰。待机时间：续航还行，一天充一次电的样子。学生价还挺实惠的，有赠品耳机，老客有礼还送了个背包登记了。,5
京东物流给力。手机是我想要的，包装大气，自带膜和壳。外观沉稳大方，很舒服。手机运行速度快，操作流畅。屏幕显示效果清晰细腻，看起来感觉好。拍照效果好，电池续航能力不错。,5
第一次用这个品牌，说实话真心没底，刚好活动价买入，收到拆箱，真的被惊艳到了，外观好看，运行快，最重要的人是没有内置垃圾软件,5
"终于等到了，地方太远了，物流自然慢一点，不过也是在预计时间之前送到了，箱子挺大的，包装的很严实，主机也挺沉的，有设计提手搬起来也挺方便，主机是没有vga,还好提前看到评论，准备了转接头，测试走起，机箱也很安静，非常满意！！",5
可以的，ⅰQooZ3我这是买第二部了，第一部女儿用2个月好才买的,5
?商品收到了，包装得很好，物流非常快，客服态度很积极，有问题及时解答！总体来说非常满意！性价比非常高?，可以放心购买?，做工非常精致?，值得购买?！?宝贝收到了，很惊喜?，设计合理，时尚大方，继续关注，以后会回购的???价格非常的美丽，东西还是不错的，会继续回购！全五分！奈斯奈斯～,5
外形外观：这个手机长的很好看屏幕音效：音效很好拍照效果：拍照很清晰运行速度：可以很快的运行待机时间：可以很长时间待机其他特色：很实惠，性价比很高，大力推荐,5
618期间买了iqoo7的传奇版，用起来很不错，所以这次家里人有需要就又来买这个机子啦，送了好几个东西很满意，手机用起来也挺不错嗯，就是送货时间有点久其他都很好。,5
手机好棒，手感不错，物流也很快，很满意的一次购物。精挑细选很久?，最后决定买这一款?，到货后果然没有让我失望，实物很漂亮?，做工很精细?，特别满意?嘿嘿嘿,5
给老人买的，挺好的，速度快，屏幕大，像素够用，运行流畅，性价比很高。买了好几款iQOO的手机了，特别适合男士和老年人用，对像素要求不高，运行速度快，硬件好，耐用！,5
很有性价比的一款手机，不比3000多的差在哪！国产机雄起！,5
不到半年时间，买的第三台iqoo手机了，在同价位来说，这个手机性价比确实不错，可以值得考虑一下入手,5
宝贝收到，包装的很好，拿出来用了可以，值得买这款手机，上网非常快，支持国产，国产越来越好!快递人员十分热情，送货上门很及时，售后客服也很贴心，帮我解决了不少疑问。,5
很好，京东商城购买手机非常满意，非常放心，都是全新正品手机。这次购买的z3手机，性能还可以，性价比很好。运行速度：运行流畅待机时间：一般般拍照效果：可以,5
这手机拥有非常快的充电速度，搭载了同价位段机型中少见的55W 闪充技术，可以52分钟内将手机的电量充至满值；还有十分耐用的4400mAh 大电池，玩游戏也很畅通    暂时没有问题,5
?心仪已久，果断下手，用过之后感觉很不错，是正品，快递也很给力，果然名副其实?质量很好，收到货第一时间打开看了，很不错，很满意，不错，喜欢，性价比高，以后会经常光顾,5
可以吧！贵了一点。在用。看看后面效果。,5
手机是完全可以的速度也很快用起来挺方便的只是最新的更新系统用起来非常烦人类,4
手机不错是正品，挺好用，而且外观非常漂亮，黑色的大气又内敛，而且屏幕的音质音效都还好，拍照效果非常棒，晚上拍的非常清楚，整个手机运行非常流畅，打开也不卡。,5
发货速度很快，昨天买今天就拿到了，非常好看滴，赶快下单吧,5
京东商城购买手机非常满意，非常放心，都是全新正品手机。这次购买的z3手机，性能还可以，性价比很好。外形外观：这款手机外观时尚精美屏幕音效：屏幕表现给力,5
用着手感还不错，第一次买这种千元价位的手机，没想到用着挺不错的，太让我惊讶了，就不知道这么流畅能用多久，这已经用了一个月了，还没发现有卡顿的情况，也没发现有其他的毛病,5
买回来给家人用的，试用了几天很不错，流畅稳定，骁龙768g日常够用比起888省电多了，试着玩了一把王者全程60不掉帧，室温25手机温热。很好这价格值了。,5
一如既往的好品质，非常喜欢的一款产品，非常棒！o(*￣︶￣*)o包装非常好，很严实，值这个价格?发货很快，两三天就到了，这个颜色我很喜欢，性价比很高，非常nice?发货很快，两三天就到了，这个颜色我很喜欢，性价比很高，非常nice搞活动买的，外观和描述一致，美观实用，材质手感都不错，好评！终于收到货了，非常非常喜欢，做工精致漂亮，已经被很多人夸了，真的太开心了，已经是他家的忠实粉丝了，以后还会继续买买买的?发货很快，两三天就到了，这个颜色我很喜欢，性价比很高，非常nice搞活动买的，外观和描述一致，美观实用，材质手感都不错，好评！,5
宝贝与描述基本一致，物流非常快，手机很漂亮，值得购买,5
"运行速度：下载东西速度特别快20,新手机终于到了，虽然它从出生地到东北逛了一圈才回来，哈哈?,外形外观：个人喜欢蓝色，果断挑选太空蓝，手机摸着不是很沉",5
手机真的太好了，充电也快，拍照也好看，那些照片都是用Z3拍的,5
用了两个月后，手机续航能力严重性下降了，充电快耗电太快了，一天至少2-3次充电,5
外形大气！运行速度快！拍照效果好！给我老伴买的生日礼物！他非常喜欢！物流非常快！昨天晚上下单今天下午就收到了！,5
这是在京东自营店里买的第八个手机了，每次购物都还满意。这个机型价比不错，外观设计时尚，屏幕分辨率挺高的拍照清晰，12+256运行很快，孩子很满意！,5
手机做工精细，用起来很好很流畅，为国产点赞点赞！,5
