评论,评分
手机不错呀，今年购入的第二个VIVO啦。5g手机觉得性价比还是灰常高的啦，摄影也不错，看着很大气哦。运行速度很快，待机时间也很长，音效很惊喜很棒！！！耳塞太有感觉了，仿佛在现场听音乐会！,5
颜值高、背盖也不会留指纹。充电速度很快，照片成像效果也清晰。,5
非常好，给妈妈用，他非常喜欢，系统很好用外形外观：漂亮屏幕音效：良好拍照效果：非常不错，能满足日常使用需求。运行速度：非常迅速待机时间：时间正常其他特色：充电快，赠品丰富,5
外形外观：十分炫酷，很喜欢屏幕音效：屏幕够大，音效符合描述拍照效果：像素很高，个人不在意这些运行速度：很完美144hz待机时间：暂时还不知道其他特色：指纹识别的地方就是锁屏键很舒服,5
手机手感非常好，电池耐用续航不错，运行很流畅，整体性价比很高，这个数据线很有特点非常方便！支持一下运行速度：运行速度很快 反应灵敏,5
"嘻嘻！想不到手机拿到手上后的感觉就是不一样，坠坠的，有点沉；处理器够用，购手机送55W快充，入耳式耳机很nice,真是太开心了，很值得购买！真是太有魅力了，拿在手上有丝滑的感觉，系统流畅，档次高，值得拥有！",5
外形外观：外观颜色靓丽，高端大气上档次，低调奢华有内涵屏幕音效：分辨率杠杠的，效果细腻，拍照效果：分辨率很细腻，自带美颜效果运行速度：8?256.大内存轻奢侈，联发科的CPU挺好待机时间：正在测试中，充电挺快其他特色：特色，这个价格这个配置可以了，也不是给我买的，到目前也没膜过远距离看这颜值挺高，智能手机是指像个人电脑一样，具有独立的操作系统，独立的运行空间，可以由用户自行安装，游戏，软件，导航等第三方服务商提供的程序，并可以通过移动通讯网络来实现无线网络接入手机类型的总称。排去离人恨，解开孤旅愁，盈盈方一握，世界眼中收。昔日灯火戏诸侯，如今四海一机通。现代信息大爆炸，无怪生活太匆匆。,5
这手机半个月时间.从2398降价到2288贬值率也太快了，,5
速度是真快，0晨下单第二天下午就收到了，包装完好，好用，比如语音助手，不会用的可以问小V，屏幕发动流畅，充电速度，44W不到一个小时就充满电了，音效也好听，侧面指纹是我喜欢的，拍照清晰，充电头很有份量，尾插接口也不错，不管那边轻轻插上就可以了，目前还没有玩游戏，简单正常一直用没有感觉电池发热，后续发热会追评,5
手机外形外观：很喜欢屏幕音效：反应很快值得购买拍照效果：像素好好没毛病运行速度：特别流畅反应很快待机时间：很长适合老人用,5
宝贝收到了，物流很给力，客服服务态度很好，手机外观很漂亮时尚大方，质量做工都不错。手机的手感很好，刷屏速度很快，音效很不错比较清晰，拍照效果很好，很清晰。运行速度很快，待机时间长。玩游戏很流畅不卡。物美价廉物超所值。,5
外形外观：外形外观中规中矩的，非常不错屏幕音效：屏幕是LCD的，看着眼睛不累拍照效果：拍照效果很好，对于爸爸妈妈来说，够了运行速度：运行速度也不错，高通处理器棒棒哒待机时间：中度使用一天一充差不其他特色：送给爸爸妈妈的礼物，他们很喜欢，运行速度也快，充电速度也快，推荐大家购买,5
手机超级棒，7.27出厂的就被我买了，体验超级棒，LCD永不为奴，3.5耳机孔，120高刷，55超级快充，拍照也还好?,5
外观方面，全新的iQOO Z3配备的是一块6.58英寸LCD极点全面屏，屏占比高达90.61%，分辨率2408x1080，支持120Hz刷新率，还支持DCI-P3广色域和HDR10，色彩表现优秀。后盖拥有精妙的弧度设计，与用户的手掌贴合。采用2.75mm超窄中框，带来了象征速度与性能的腰线，机身厚度为8.5mm，机身重量是185.5g，极为轻薄。此外，该机提供有深空、星云两种配色。配置方面，iQOO Z3搭载高通骁龙768G处理器，最高8+256GB存储，采用&ldquo;超级液冷散热热管+多层立体石墨散热片+高导散热铜箔+导热凝胶+6颗温度传感器&rdquo;的五重液冷散热系统，后置6400万像素超清主摄+120&deg;超广角镜头+4cm微距镜头的后置相机组合。此外，该机内置4400mAh大电池，支持55W闪充。值得注意的是，该机的Type-C接口内触脚Pin使用比镀金效果更好的稀有&ldquo;铑钌&rdquo;金属镀膜，具有出色耐腐蚀耐磨损性能，通过一万次插拔和摇摆测试，使闪充连接失效率大幅降低。总体来说特别适合购买，而且有很大幅度的优惠！！！,5
该手机性价比较高，快充也是很快，充一小会电就好了够使用一会了，星云外观适和女生使用。像素也可以满足日常使用，买了内存最多的款式，平时应该够用的哈,5
外形外观：还可以很漂亮，手感也挺好，比我用了多年的r9好多了屏幕音效：屏幕效果中等，一般应用手感很跟手，音效还可以，毕竟科技一直在进步拍照效果：拍照效果还可以，日常使用足够运行速度：目前刚到手，效果还可以，有待日后使用追加待机时间：刚到手，有待测试其他特色：颜色不错，很时尚，很喜欢，就是花定金订购的，付完尾款一看，比直接购买还贵50元还少一个蓝牙耳机，这是几个意思，这样以后还会从京东付定金吗？购买东西一直信赖京东自营，速度快，东西帮，这次预定事件会不会给老用户一个交代呢，有待京东回复解释对待不要伤了精心培养出来的老用户的心。赠品价格不值多少钱，态度处理很重要的,5
很不错，尤其后置摄像很清晰，网速也不错，充电很快，充一次可以管一天，一直使用可以管一天，便宜好用,5
收到手机后，感觉还挺满意的，外形外观很漂亮，声音效果不错，听的很清楚，运行速度挺快的，内存很大，不用担心不够用，手机充电很快，没充一会就快满了，不愧的闪充，玩王者有时候会断流，系统还有待改进日常够用，其他等用完一段时间再来评吧,5
手机很好 颜值非常高 买给妈妈的 因为妈妈之前的手机声音太小了 这个手机就很适合妈妈用 电量也很OK 推荐购买 运行速度也很快 是正品,5
外形外观：材质结实，手感好，很得劲，物流也快，性价比很高，值得购买屏幕音效：商品质量不错，细节、品质、做工都非常好，发货贼快，快递也给力，棒棒哒~???拍照效果：完美，产品很惊艳，性价比合适，希望用的长久！运行速度：到货就迫不及待打开了，果真没有让我失望，质量特别好，颜值也相当高，满意的一次购物,5
超级喜欢这个颜色，vivo手机也是用了好几年了，使用感受不错，这次是买给妈妈的，这个配置老人用绰绰有余。妈妈说手机很快，拍照也清楚，现在手机更新换代太快了，配置也越来越高。,5
【优点】电池真的好耐用，重度游戏几乎一天不充。打游戏（王者60帧）不发热也不卡。打开软件很快，平均2-3秒。90hzLCD，5000毫安电池，18瓦快充。天玑800U（疑天玑720），双卡5G。支持高通骁龙aptx蓝牙传输模式（别问我联发科的CPU为什么支持，我也不知道）。系统功能还算完整，有很多方便的操作，例如相册里面图片编辑功能很多也很实用，还有长按智慧识屏提取文字等等。便宜，综合说对于一般用户或者游戏用户性价比较高吧。【总评】优点：电池真的好耐用，重度游戏几乎一天不充。打游戏（王者60帧）不发热也不卡。打开软件很快，平均2-3秒。90hzLCD，5000毫安电池，18瓦快充。天玑800U（疑天玑720），双卡5G。支持高通骁龙aptx蓝牙传,5
很快，很好，凌晨两点付款，上午10点就送到楼下了，家里原来的三台ⅰQOO用的都蛮好，所以这次又换的，感觉良好，本来想在官网买的，有游戏充电线和耳机送的，**也有(犹豫了一下，没抢到)，京东什么也没有，考虑到急用，还是在京东下了单，要是有赠品就完美了,5
外形外观：产品外观非常的漂亮，色彩艳丽，也方便把握。屏幕音效：屏幕色彩艳丽，刷新率很高，显示非常的清晰。拍照效果： 相机拍照功能非常的强大，照片清晰锐利，也有很多模式选择适合小白使用。效果见下图。运行速度：运行速度非常的快，比我以前的y67快多了。待机时间：用了一整天，还有56%的电，非常的不错其他特色：快充非常的给力，很快就充满电了。,5
手机质量很好，画面清晰，反应灵敏，网速很快，是正品！价格比实体店卖的要便宜很多 ，京东的物流也相当的给力 真的很满意呢 ！,5
144HZ堪称完美，天机1000处理器绝对够用，看了大腿的腿，决定入坑，机器质感满足这个价位的要求，性价比极高，系统简单流畅，打了几把王者，还是很不错的，总体很棒，后盖虽然是塑料，但是真心看不出来，个人认为这个价位算是小无敌了，值得入手。,5
手机外观很不错  颜色好看   这个牌子的手机用了好几个了   拍照还不错  运行速度也可以嗯  大电池很给力   还额外多送了一个充电器,5
手机颜值很高，性能也很好，一千多的手机感觉拍照也挺好的，我试了下王者能开最高而且不卡，音质就普普通通了，主要是照相就很清楚。买来个老妈用的。感觉物有所值,5
手机收到啦，非常喜欢，手感特别好，外观也非常美观大气l界面美观，待机时间长，拍照清晰，屏幕很大，色彩饱和度不错，极速充电，运行不发r&egrave;热，，价格便宜！ 上一部手机也是vivoY73。好用不b&ugrave;！,5
外形外观：好看，霸气，是我喜欢的颜色屏幕音效：屏幕很棒，也很大，不刺眼 声音也很好，最大声音也不刺耳拍照效果：拍照挺好的，比我的苹果8强多了运行速度：太快了，太丝滑了 玩王者直接无敌,5
想在618的时候给妈妈买手机，提前就把这款手机看上了，正好618有活动就买了，这个价格很划算，手机也好用，老人用就看看视频，然后就微信聊天拍照，完全够用,5
外形外观：高端大气上档次屏幕音效：感觉新颖，爱不释手拍照效果：可以，各种美颜效果很好运行速度：玩游戏没问题待机时间：待验证，总体而言这款手机不错，运行速度快，屏幕反应迅速。,5
非常棒的手机，喜欢vivo.喜欢王者荣耀，所以还是买个IQOO外观漂亮，运行流畅，新系统也不错。好用。经济实惠。完美。,5
非常好的手机，之前一直用三星的，这次手机摔坏了，换了一个vivo。手机照相强大，画质清晰。速度也比较快，外观颜值很高，屏幕特别喜欢，反应灵敏。,5
偷偷买给老公的礼物~婚后换了两部手机都是老公送的。我也想给老公一个惊喜，本来打算结婚纪念日再送的，正好老公最近老说手机卡，说内存不足，我就用自己工资偷偷买了一部，喜欢vivo的手机，之前中间也换过别的国产品牌，但不是屏碎的快就是系统不行，vivo的设计也很走心，喜欢，还送了手游充电线，质量很好。希望vivo越来越好，喜欢国产。,5
"手机丢了急需换部新电话，选来选去挑的iQOO Z1. 因为下雪影响了送货时间。收货后，拿在手里手感不错，随后后壳是塑料的但是一点不影响拿在手里的手感，份量正好，不会很沉。赠送的手机套也可以，出厂已贴膜，屏幕清晰。预先安好一些常用的app,省去很多安装时间，不用的可以删除。充电时间很快。现在使用中，以待观察使用时间如何。",5
快递一天就到了，非常快，快递员很辛苦，是正品，手机用了一天，没有出现任何卡顿，喜欢拍照的小仙女们很推荐这款手机，拍照风景很好，自拍也是很好看，内存够用，还剩了很大的内存。打游戏也是很合适。像素也很好，真的很不错，还会再来买的。,5
这款手机看起来不错，到手就很吸引人，外观也很漂亮，已经多次购买了，充电速度超快，让我非常的满意，反应也挺快的，大爱希望以后多多搞活动,5
性价比很高，充电快，拍照效果很好，反应速度较快，使用体验到现在感觉良好，有活动时还能更便宜一些，主要是能节省不少时间，京东自营的商品质量还是有保证的，退换也很方便。,5
vivo IQOO   z3 颜色 外观漂亮，6400万拍照清晰 还送了原厂配件 耳机，高通骁龙768G处理器，性价比高 反应非常快。,5
外形外观：非常不错，星河银颜色很好看，很喜欢这个颜色屏幕音效：144hz非常流畅，属于用了就会不的那种拍照效果：拍照效果还行，够用运行速度：天机1000plus还行，日常用起来还不错，用着还可以，反正不打游戏待机时间：待机时间还没有测试过，有空追加评价,5
外形外观：绚丽多彩很耐看屏幕音效：声音洪亮拍照效果：6400万像素够用了运行速度：速度还行不卡待机时间：很不错，快充很快其他特色：买这款机子主要还是因为便宜和京东售后有保障。,5
手机收到，迫不及待想见你的真面容，拆开后，小惊喜，样子好看，握感很好，开机快，很流畅，上手快，购买时正好有活动，优惠后很实惠，希望手机一直好用。,5
外形外观：外观很好看，不会太臃肿，是修长型的。方便，一只手可以握住。是买给妈妈的，她觉得很好。是比较好看的手机。其他特色：性能不错，有小组件，还有右侧边可以划出卡包，方便支付.屏幕音效：屏幕是流线状的，非常好看待机时间：觉得还是比较长的，充电也很快，妈妈玩手机大户也是不会担心没电的运行速度：新机运行还不错?，不知道之后怎么样，但是这个价格还是很合适的，不管怎么样，肯定也是性价比超高的拍照效果：拍照起来还不错，有非常多种功能，大光圈范围很大，可以拍到超大角度的范围，除此之外，拍照的像素也足够高，足够日常使用了.总结：这一次没有买错！,5
外形外观：手感还可以，屏幕音效：看起来很舒服拍照效果：超级超级好看，拍的很清楚运行速度：768G处理器运行很快，值得购买，一开始忧虑很久才拍的,5
外形外观：外观时尚，令人惊叹，渐变色吸引眼球，轻薄不压手，适合单手握持。屏幕音效：屏幕色彩艳丽，像素清晰，大屏幕看电影更精彩，独特音质令音乐视频享受。拍照效果：拍照效果完美，像素大，放大清晰，颜色写实，美妙绝伦。运行速度：运行速度流畅到飞起，8核心，能力超强。待机时间：待机时间令人满意，大电池 待机更持久。其他特色：144hz屏幕刷新率，5g高速链接，令人爱不释手。,5
颜值高，手感好。用起来很流畅。最好配保护套，因为亮色的机身容易留指纹,5
东西不错，做活动买的！处理器厉害，各方面比较均衡，我自己不玩游戏，应该是送是足够了！之前一直都是用的华为的手机！现在华为的手机性价比不高了，就买其他的了！手机拿在手上很有份量！尽然还保留了耳机插孔，44w快充应该是够使用了！,5
快递的速度非常的快，手机的做工也很好，高刷非常的顺滑，电池很耐用，快充很给力，一个小时充满，美中不住的就是手机后盖是塑料的，手感有点怪异，不过这个价格真香，作为备用金，很优秀了，而且系统还可以，从荣耀无缝衔接，很快适应了,5
这个手机非常不错啊，总体上重量轻，价格也很nice。外形外观：十分漂亮?拍照效果：非常清晰屏幕音效：挺不错运行速度：挺快的，他双系统非常不错啊待机时间：非常长啊，55w充电也非常快。,5
手机外观不错，单手握持方便，不是很大的感觉，挺好的。屏幕颜色鲜艳，日光下能看清。系统流畅，切换软件不卡顿，内置的大多数第三方软件都可以方便卸载，很棒！电源键和指纹结合在一起，刚开始不习惯，几天觉得很方便，人脸识别，开屏也好用。这个机器入手，让我对这个品牌了解不少，原来一直用的小米，看来各大厂家发展的都不错。,5
大学给自己换了个新手机 就选择了这款iQoo了8.6手机到的 用了10天了今天来评价一下~1 有新消息时这个屏幕会闪亮的2这个手机后置摄像头拍的简直绝了 很清楚哦3再就是这个手机的快充能力了 我感觉我一天都不用充电的 当然啦 我不玩游戏 可能手机耗电少些4手机的屏幕刷新率很赞 5用了10多天 没有手机烫手的现象这个手机的散热系统也很棒的6最爱的就是它的巨行内存了12+256 简直满足需求。。尤其是照片多的可以考虑一下哦 最后 店家还赠送了一个原厂耳机 音质不错。很满意啦~,5
外形外观：外观漂亮屏幕音效：声音宏亮拍照效果：拍照清晰运行速度：运行可以待机时间：一天一充其他特色：机很新很漂亮， 手持舒适，充电特快，几十分钟就充满，昨天收到的，今天试用了一天，感觉挺好，拍照很清晰，手指指纹都能看清楚，录视频也很不错，就看以后怎么样，好了就还在这里买手机，谢谢商家,5
外形外观：在不同的观赏角度之下，它可以呈现不同的颜色，看起来就像是一块精致的艺术品。出门携带即使没有任何手机壳和挂饰的加持，它依旧可以时尚出圈。屏幕音效：它的屏幕采用的是LCD，而且这次iQOO Z1把指纹的解锁设计在了侧面，一触即开。由于指纹设计做的很窄，所以它既不占用手机机身平面的使用空间，而且还提升了美观程度。拍照效果：后置摄像头采用的是4800W像素的AI超广角三摄系统，。iQOO Z1此次采用了一颗4800万物理像素主摄+112&deg;超广角摄像头**距镜头的组合，能够把拍摄的风景尽收眼底，清晰的像素显示，无论是拍人还是拍景，随手一张都是艺术照，特别照顾不会拍照的小白。运行速度：144Hz的屏幕反应速率真的不是盖的，主要的就是在游戏的体验上。根据《王者荣耀》的测试效果显示在游戏的过程中，手机可以保持在59-61帧之间稳定运行，特别是当特效全面开启的时候，画面效果相当震撼，一点也不卡顿。待机时间：iQOO Z1的充电方案是44W vivo Super FlashCharge闪充技术，23分钟就可以满足50%的充电，平时吃个饭的功夫就可以把电量充满，有这样的快速充电技术搭配长续航电池，平时手机再怎么玩也可以迅速回血。其他特色：5G+5G双卡双待,5
质量非常好，外观设计非常好看，软件运行流畅，触摸屏幕非常好，参数配置非常高，不错的一款手机，发货和配送速度，，,5
外观大气，拍照特别清晰，声音很大音质也不错，运行速度很快，刚开始用，待机时间还不确定，,5
外形外观：很酷炫很漂亮很亮眼屏幕音效：屏幕显示细腻清晰度很高，音效很棒，听音乐很high拍照效果：拍照很清晰，美颜很好用运行速度：相当快，相当流畅待机时间：很长，正常用一天足够,5
其他特色：快充，充电速度快 拍照效果：像素高 电池续航：续航长，一天充一次就够了 通信音质：很好，很清晰 运行速度：很快 显示效果：拍照效果很好，很清晰。手机颜值高，性价比高，运行快，充电快，续航时间长。,5
送妈妈的，她喜欢听歌，这个音质还可以，声音也很大。她之前用的苹果系统，用这个系统用着很顺。一下就上手了。,5
外观好看，手感很好，充电速度快，操作界面简洁大方，运行速度快。,5
宝贝包装很用心，物流也很快。宝贝外观精致，好看漂亮，拿在手中大小适中、重量正好，厚度偏薄，手感比较舒适；最让人兴奋的是配有55W快充，果然是名副其实，充电~~超级快~~；不但充电快，音质和画面也好，120Hz屏幕流畅顺滑，运行起来一点儿也不卡顿，眼睛非常舒服，让人超喜欢；另外配有入耳式耳机和大王卡，待机时间也满意，总之大品牌用起来比较放心，宝贝让人爱不释手，有颜值有品质，既物美又价廉，性价比较高。很满意的一次购物。赞一个！,5
手机大小合适，轻重正好，手感舒适，运行流畅，家人超级喜欢。,5
上游戏挺快的游戏功能也很多，我最喜欢把他投屏在电视上的那个功能，自从我用了这个投屏功能，我爸总能拿理由在揍我，游戏音效也十分不错，拍照跟开美颜似的不错，推荐,5
价格合理，1599的价格性能还是非常强悍的，不卡顿，散热性能挺好，充电确实够快的，刚打开是32的电量，充电40分钟100了，手机还是很轻，拿时间长了不会累，虽然比不了高端手机的手感，但是对的起这个价格，侧边指纹解锁很快，还有人脸识别系统，使用非常方便，预约购买减100很划算，还送了耳机，原装充电器数据线，运动背包。诚意满满。非常开心?。京东物流相当给力，早上10点交尾款，下午18点拿到手了。待机时间也非常满意，早上8点到下午14点一直刷视频电量还有67呢，满意。,5
性价比很高，性能好，操作流畅，颜值也很高，音质清晰，系统稳定，拍照像素也很高，特别满意，推荐购买。,5
以以前买过一台vivo的z5，用用了以后用了一年多，感觉还是不错的，质量很好，摔了几次都没摔坏，所以这次换机器还是选择了vivo品牌的，手机不错，物美价廉，希望可以多用几年,5
外形外观：外观好看，做工很好，机身很薄，手感不错，颜值很高！屏幕音效：屏幕完美，显示效果很好，色彩斑斓，音量很大，音质不错！拍照效果：拍照清晰，反应很快，色彩逼真，像素很高，非常Ok！运行速度：运行非常畅快，行云流水，点到即来，感受颇好！待机时间：待机时间还行，充电还可以，中规中钜！,5
外形外观：颜色很漂亮，一闪一闪的屏幕音效：音质很好，画面不卡顿，果然选z3没错拍照效果：拍照很清晰，像素很高，平时拍照都没问题运行速度：iqoo作为一款游戏手机，骁龙768八核处理器算是很好了，还有55w快充，加上4400毫安大电池，别忘了这可是一款1500左右的手机待机时间：各个方面都很好，待机时间还是可以的其他特色：这么好的千元游戏手机，学生党可以放心入,5
细节到位，可以看一下我用这手机拍照。还有送了我许多赠品，其中学生或者高考生都是有的，我就有那个无线耳机，和充电宝，不同时期优惠不一样，你可以多留意一下。那个指纹解锁非常灵敏，声音挺大的，我都感觉可以把声音开最大聘美老年机了 拍照效果非常棒，太爱了，拍照清晰，画质感人，且有多种模式，像新手小白就可以尝试买这款手机。吃个饭，走一走的时间就充好了，建议大家开启超级省电模式，有意想不到的惊喜哦。打游戏，录视频，通话等完全不用担心卡顿的想象。进入游戏后，就会显示你的gpu，CPU的运行，还可以调节帧率，非常棒，游戏震感，拒接一切来电，都是基本操作啦，功能非常良心啊 显示效果非常炫哦。酷*我了比如有消息来时，那个边框都可以自己设置，还有充电特效也很花哨,5
帮同事买的手机，物流也很快就到了，拿在手里手感不错，感觉可以，外包装看着也不错，充电器看着也好好，同事很喜欢，黑色的大部分人都喜爱的颜色大气屏幕手感也很快，运行内存也很好,5
手机收到了，外观很好看，手感也很舒服，充电快声音像素这些功能都还可以,5
快递速度超快，外形外观：轻薄漂亮。屏幕音效：色彩靓丽，音质纯净。运行速度：运行速度流畅。待机时间：电池够用，55W闪充超快。,5
用了半个月后来评价，用过vivo的三台手机一直都是颜值在线，性能与性价比商质量不错，细节、品质、做工都非常好，发货贼快，快递也给力，赶上活动购买非常的划算，新的系统非常流畅，音质也不错播放音乐。游戏都非常流畅。拍照非常的清晰。夜景模式的时候非常的棒。屏幕的刷新率非常感人。续航基本一天半是够用的，充电非常快，真能做到15分钟充满60%的电量，优化各方面的体验都挺好。Vivo加油！,5
